link,date,text,retweet_count,favorite_count,reply_count,commentId,parentId
https://x.com/animetv_jp/status/1678562288880500736,Tue Jul 11 00:30:10 +0000 2023,"【English Dub Trailer】
Zom 100: Bucket List of the Dead
Scheduled for August 6 on Netflix &amp; Hulu! 

(Animation Production: BUG FILMS)

✨More: https://t.co/wSu10RR0lI
 https://t.co/Nzm4xusskP",715,6551,54,1678562288880500736,0
https://x.com/liliesrain/status/1681863455710806017,Thu Jul 20 03:07:50 +0000 2023,the op said when they opened Netflix an unexpected bug happened and they got this dream x jujutsu kaisen crossover lol 😭 the likes &amp; rts also the views??!!!! the qrts are also funny dgakdhakdhak free promo for iu dream team!!!! https://t.co/5fypaxyBtV,65,199,2,1681863455710806017,0
https://x.com/proteinwisdom/status/1675834133527027713,Mon Jul 03 11:49:27 +0000 2023,"No gas stoves. No wood-fired pizza. No drilling. No gas-powered cars. No coal. No nuclear energy. 

You’ll live in pods. You’ll eat bugs. You’ll travel only virtually. You’ll toil, binge Netflix, then die at 65. Free will is over.

This is the global left’s Utopian vision.",24,57,8,1675834133527027713,0
https://x.com/corded_warez/status/1682851301644808193,Sat Jul 22 20:33:10 +0000 2023,waste beer / lab meat / bug powder / vasectomy / therapy / statin / SSRI / netflix / peloton / restaurant / happy hour / waste beer / voting / cocktail / netflix https://t.co/EKyB6wsBw5,0,0,0,1682851301644808193,0
https://x.com/IsIsConfined/status/1676647998112014336,Wed Jul 05 17:43:28 +0000 2023,Streaming bugs me because what if Netflix shuts down? Does that mean I can’t see any Netflix original content ever again? Should I just go record Watership Down to VHS somehow?,0,6,4,1676647998112014336,0
https://x.com/AnimeTelchi/status/1680301035288662016,Sat Jul 15 19:39:19 +0000 2023,"English Dub Trailer:
Zom 100: Bucket List of the Dead
Scheduled for August 6 on Netflix

Animation Studio: BUG FILMS

https://t.co/BP3bjG7DMH",0,0,0,1680301035288662016,0
https://x.com/XWFOUTLAW/status/1678196595878252544,Mon Jul 10 00:17:02 +0000 2023,"#NowWatching (*seasonal*)
'ZOM 100: Bucket List of the Dead'.
[BUG] [Netflix/CR/Hulu] https://t.co/ZhwmI2hgbh",0,0,0,1678196595878252544,0
https://x.com/kiyuseiu/status/1684846614501101568,Fri Jul 28 08:41:50 +0000 2023,the miraculous lady bug movie on netflix was so good 🥹🤍 my childhood i’m crying pls,0,5,0,1684846614501101568,0
https://x.com/kristhaaang/status/1683636035786522624,Tue Jul 25 00:31:26 +0000 2023,"netflix kicked me out of my family account so AJ and I have resorted to watching old movies on disney+ and they have GMFU!! 

like A Bug's Life!?!? 
I wasn't shook when I was 6, but I am now actually disturbed.",0,4,0,1683636035786522624,0
https://x.com/ItsMe_SP_/status/1681859357535870977,Thu Jul 20 02:51:32 +0000 2023,Nobody bug me a new season of Too Hot To Handle is on Netflix,0,5,0,1681859357535870977,0
https://x.com/powerhouseanim/status/1681114100091240448,Tue Jul 18 01:30:09 +0000 2023,"This baby rock bug was minding its business but had some quick reflexes! 🐛💨

The artists behind the animation:
Rough/Tie Down Animation: Athena Hao
Clean Up/Color: Cindy Crowell

@Legendary’s Skull Island is streaming now on @netflix!

#SkullIsland #Legendary 💀🏝️ https://t.co/riUZMTi3rX",26,154,3,1681114100091240448,0
https://x.com/eveoid/status/1679211441373474826,Wed Jul 12 19:29:40 +0000 2023,brush bug if witch hat atelier got a netflix live adaptation,0,2,0,1679211441373474826,0
https://x.com/Kally8704/status/1680363499942232066,Sat Jul 15 23:47:32 +0000 2023,how can my netflix bug out right in the middle of my show??? out of order,0,0,0,1680363499942232066,0
https://x.com/2Bunbunz/status/1679232516367196161,Wed Jul 12 20:53:25 +0000 2023,They put The Wiz 👠👠 on Netflix. I think my Bug would like to watch it 🤞🏾,0,0,0,1679232516367196161,0
https://x.com/maegaann_/status/1685766465528401920,Sun Jul 30 21:37:00 +0000 2023,this is the best thing that could’ve happened for a girl like me (the lady bug and cat noir movie is on netflix 🤭),0,2,0,1685766465528401920,0
https://x.com/paulinverdades/status/1685813545223561216,Mon Jul 31 00:44:04 +0000 2023,Lady bug na netflix?,0,0,0,1685813545223561216,0
https://x.com/kazurella/status/1685159736717524992,Sat Jul 29 05:26:04 +0000 2023,gonna watch the lady bug and cat noir movie ong i forgot it releases on netflix yesterday,0,2,0,1685159736717524992,0
https://x.com/coaster_fan/status/1685069076907925506,Fri Jul 28 23:25:49 +0000 2023,"As an adult who enjoys watching Miraculous:lady bug and cat noir.. the movie on Netflix was cringey,no clue why they decided to  do a musical with the singing voices no where near the same voice or feelings of the OG. And how they all but ruin  the long story built in the series.",0,5,0,1685069076907925506,0
https://x.com/wargonm/status/1675468048315166721,Sun Jul 02 11:34:46 +0000 2023,Tiens Netflix a pas de bug,0,22,4,1675468048315166721,0
https://x.com/Tia_NoMowry629/status/1685413963763212289,Sat Jul 29 22:16:17 +0000 2023,"On my off days, be me and Netflix til bug want something",0,0,0,1685413963763212289,0
https://x.com/Kipotekcom/status/1748314668391682537,Fri Jan 19 12:01:13 +0000 2024,"Discover the ultimate in pet pampering! Our Pet Bed offers a cozy retreat your pets will adore. This premium product features an adorable &amp; robust design that blends seamlessly into any home decor.
Wait no more to offer luxe comfort to your fur-babies.
👉 https://t.co/eRDF4nqG4l https://t.co/FV9SELvJBi",1041,14458,0,1748314668391682537,0
https://x.com/neon_evangayion/status/1677727991743520768,Sat Jul 08 17:14:58 +0000 2023,"i dont get why there are no giant bug vtubers, i can watch annoying anime girls all day long on netflix, netflix doesnt have any giant bugs playing indie games tho.",3,9,1,1677727991743520768,0
https://x.com/apitch13/status/1678146734889869312,Sun Jul 09 20:58:54 +0000 2023,"Laying in bed with a slight fever and a half swollen face from a bug bite and watching Netflix is actually peak summer for me 😅✌🏻 

(I swear, if it was a spider and it bit me right after I watched SpiderMan, my cat is FIRED)",0,3,0,1678146734889869312,0
https://x.com/Rahul54184818/status/1684299539010789376,Wed Jul 26 20:27:57 +0000 2023,"#Netflix @NetflixUK

Just found a bug related to the title ""Manifest"". It shows season 1 and season 4.  Where are seasons 2 and 3? https://t.co/VEqfcpLGA4",1,1,0,1684299539010789376,0
https://x.com/DaffierDragon15/status/1685070447358910464,Fri Jul 28 23:31:16 +0000 2023,Bro netflix I don’t want to watch miraculous lady bug,0,0,1,1685070447358910464,0
https://x.com/HyrienInc/status/1729606197404192975,Tue Nov 28 21:00:26 +0000 2023,"After almost 5 years, we are completing our internationalization today with the latest extension 'Around the World', including Ethiopia and Tanzania, reaching a milestone. 🌍

Learn more: 
https://t.co/8eXDQOaeto https://t.co/PgY2j5S6MG",30,393,20,1729606197404192975,0
https://x.com/MaeInTheBox/status/1679518758950371332,Thu Jul 13 15:50:50 +0000 2023,"It's not even the bare minimum 
It's bottom of the barrel, in the cracks type 
But #KingTheLand has a scene where he asks for her consent to kiss her and the female lead actively participates in the kiss instead of tht 2016 bug eye thing they had going pre Netflix",0,1,0,1679518758950371332,0
https://x.com/Sam_Huncho/status/1679193314921152518,Wed Jul 12 18:17:38 +0000 2023,"They need to come out with Season 3 of Human Resources on Netflix. That show is so relatable. Especially because I know I have a depression kitty, anxiety mosquito, addiction angel, love bug, greed gremlin, and logic rock in REAL life😂",0,3,1,1679193314921152518,0
https://x.com/tyunhiyyih/status/1677622650498170881,Sat Jul 08 10:16:23 +0000 2023,i remember when netflix was just a dvd service and my grandad would burn cds as a hobby so i'd bug him for every pokemon dvd so that's how i watched everything from og to end of diamond &amp; pearl as a kid,0,1,1,1677622650498170881,0
https://x.com/drawingtara/status/1685274014800084992,Sat Jul 29 13:00:10 +0000 2023,"I'm watching miraculous lady bug oh Netflix the movie yk
DAMN ITS SO PRETRY THE VISUALS ARE SO GORGEOYS",0,0,0,1685274014800084992,0
https://x.com/RealDMWalton3/status/1677111481513521153,Fri Jul 07 00:25:11 +0000 2023,A reminder; y’all better not bug me for shit in September when Top Boy’s final season comes out on Netflix lmao,0,2,0,1677111481513521153,0
https://x.com/bownightt/status/1685521512009539585,Sun Jul 30 05:23:38 +0000 2023,pota 😭 my gr5 self will freak out if she knew that theres a miraculous lady bug and cat noir movie in netflix,0,0,0,1685521512009539585,0
https://x.com/xivN_Monarque/status/1685307107313123328,Sat Jul 29 15:11:40 +0000 2023,LADY BUG AND CAT NOIR’S NETFLIX MOVIE IS NOT FOR KIDS!!!! WTF I AM PISSED.,0,0,0,1685307107313123328,0
https://x.com/AnneCpc/status/1680129031146987520,Sat Jul 15 08:15:50 +0000 2023,"Honestly, that some actors on Bug time rush don't get paid at all for the views on Netflix is ridiculous... did not know that things work this way. And they shouldn't",0,0,0,1680129031146987520,0
https://x.com/Charmypuff/status/1684923912629460992,Fri Jul 28 13:48:59 +0000 2023,THE MIRACULOUS LADY BUG MOVIE IS ON NETFLIX!!!!!! https://t.co/95maHmmU21,0,0,0,1684923912629460992,0
https://x.com/sheridanalumni/status/1684924018963468288,Fri Jul 28 13:49:25 +0000 2023,"If you’re looking for something new to watch this weekend, check out Lady Bug &amp; Cat Noir: The Movie, now on Netflix. Sheridan grads worked on the animation of the film based on the television series featuring the same characters. https://t.co/sA0Lz3SfNd",1,2,2,1684924018963468288,0
https://x.com/Elfanilla/status/1677516059190886402,Sat Jul 08 03:12:49 +0000 2023,NEW MIRACULOUS LADY BUG MOVIE IS COMING OUT THIS MONTH ON NETFLIX AAAAAAA!!!!!!!!!! I WANT TO MAKE A SUPER HERO MAGICAL GIRL OC NOWWWWW!!,0,4,2,1677516059190886402,0
https://x.com/anicenter0/status/1678736967981494273,Tue Jul 11 12:04:17 +0000 2023,"【English Dub Trailer】
Zom 100: Bucket List of the Dead
Scheduled for August 6 on Netflix &amp; Hulu! 

(Animation Studio: BUG FILMS)

✨More Info : https://t.co/c615uHAKr3
https://t.co/7SWcK8YFve",0,0,0,1678736967981494273,0
https://x.com/R_Barnes407/status/1677108204063391746,Fri Jul 07 00:12:09 +0000 2023,Pressure Cooker on Netflix is a perfect blend of Chopped and Bug Brother. Legit show through 1.5 episodes.,0,2,1,1677108204063391746,0
https://x.com/FerreiraGabisz/status/1680390375796535296,Sun Jul 16 01:34:20 +0000 2023,Netflix teve bug?,0,0,0,1680390375796535296,0
https://x.com/jacobc_eth/status/1675713069396238338,Mon Jul 03 03:48:23 +0000 2023,Is there an alternative to Teleparty / Netflix Party that doesn't constantly bug out and have strange syncing issues?,0,2,1,1675713069396238338,0
https://x.com/urcutieassian/status/1685127840403275776,Sat Jul 29 03:19:19 +0000 2023,I was excited to show my bf that lady bug and cat noir movie is on Netflix already but my screenshot says something else lmao. HUHUHUHHAHAHA https://t.co/DVar01dOAh,0,1,1,1685127840403275776,0
https://x.com/aWeekLate/status/1675274789961838592,Sat Jul 01 22:46:49 +0000 2023,"Watching @ManifestNFLX: S04 E12 - ""Bug Out"" https://t.co/4jM0uIsRf8 on @netflix!

#Netflix #TV #Action #Drama #SciFi #Time #TimeTravel #LATE #aWeekLate #AloneTogether #Manifest https://t.co/CP3bhgn4cJ",0,0,0,1675274789961838592,0
https://x.com/1MagicallyMandy/status/1677739449155829761,Sat Jul 08 18:00:30 +0000 2023,"I just discovered threads and I am going to bug Netflix over there.  I need my shows back. Starting with Half Bad, Lockwood &amp; Co, &amp; The Inside Job.
#HalfBad #SaveHalfBad #TheBastardSonAndTheDevilHimself #SaveInsideJob #FandomsUnited

INSIDE JOB ISN'T HALF BAD https://t.co/kTgXl28lcH",4,4,0,1677739449155829761,0
https://x.com/Thebigblackram/status/1680022445309263873,Sat Jul 15 01:12:18 +0000 2023,One of my kids got control of the Netflix account and changed my avatar to a confused looking bug! Well played kiddo. Well played.,0,0,0,1680022445309263873,0
https://x.com/Amae31107302/status/1684773947579965441,Fri Jul 28 03:53:05 +0000 2023,No tengo Netflix ya no vi Lady bug 😀👍🏽,0,1,1,1684773947579965441,0
https://x.com/LogicoolG/status/1726468448879096011,Mon Nov 20 05:12:09 +0000 2023,"【NEW】Crazy Raccoon おぼ 選手がいち早く体感！

世界のトップ選手と共同開発したLogicoolG PROシリーズから、
新登場した、さらにハイエンドな「PRO X シリーズ」の
リアルな感想を動画でチェック

▼画像タップで、動画本篇へ▼",443,5676,462,1726468448879096011,0
https://x.com/GI_Tweets/status/1681783318524702723,Wed Jul 19 21:49:23 +0000 2023,"CD Projekt RED releases 4.04 update for The Witcher 3: Wild Hunt, bringing bug fixes, quality of life updates, and Netflix-inspired content to Nintendo Switch. #Action #Adventure #GamingNews

🔗 Click the link for the full details!⁠
https://t.co/u8QD7iZKrN https://t.co/aGQzc230eN",1,2,1,1681783318524702723,0
https://x.com/Anime_SKD/status/1678729398701395969,Tue Jul 11 11:34:12 +0000 2023,"ENGLISH DUB TRAILER: Zom 100: Bucket List of the Dead Scheduled for August 6 on Netflix &amp; Hulu!🎉Animation Production: BUG FILMS 

#Zom100 #anime #ゾン100 https://t.co/jS7PD7B3wv",0,1,0,1678729398701395969,0
https://x.com/lovemelive/status/1684882824539865088,Fri Jul 28 11:05:43 +0000 2023,THE LADY BUG AND CAT NOIR MOVIE IS OUT ON NETFLIX,0,0,1,1684882824539865088,0
https://x.com/AleksLzr/status/1677226263004725248,Fri Jul 07 08:01:17 +0000 2023,"@netflix the app bug, is that normal ?",0,0,0,1677226263004725248,0
https://x.com/TheQuillBot/status/1703720519814492480,Mon Sep 18 10:40:00 +0000 2023,"Do you want to communicate more clearly at work? Try QuillBot. It's an online writing platform that can instantly make your written communication concise and professional. Plus, you can optimize your tone to ensure you're connecting with your audience. Try QuillBot today.",229,2870,178,1703720519814492480,0
https://x.com/W0ODZLUV/status/1682118245950660608,Thu Jul 20 20:00:16 +0000 2023,"@wakenaotaku i already started it on netflix, the bug is still there i dont know exactly why does that happen, anyway if i can watch my husband thats okay!",0,0,1,1682118245950660608,0
https://x.com/nijioniart/status/1682931762970632193,Sun Jul 23 01:52:54 +0000 2023,"@JoeyMontega @OP_Netflix_Fan @OPLAfandom @onepiecenetflix There’s 3 mysteries that bug me the most about OP, the egg, the giant shadow figures, and the big straw hat (pretty sure that was the original joyboy’s tho)",0,0,1,1682931762970632193,0
https://x.com/Big_Bossman24/status/1682772427590316032,Sat Jul 22 15:19:45 +0000 2023,wait is this a bug or something? AvED is still on netflix for me,0,0,0,1682772427590316032,0
https://x.com/JamieNicoll2002/status/1679651537788850177,Fri Jul 14 00:38:27 +0000 2023,@gowler42 @NetflixUK I’m watching it just now on my Netflix. Definitely a bug mate.,0,0,0,1679651537788850177,0
https://x.com/Android_Hawk7/status/1684319971604570113,Wed Jul 26 21:49:09 +0000 2023,@Lenny_Bons @engineerreacts I was at android 14 beta 4 but switched back to stable because of system Performance and a netflix bug annoyed me,0,1,0,1684319971604570113,0
https://x.com/jonathanbechar9/status/1684044063111249920,Wed Jul 26 03:32:47 +0000 2023,Get a life Netflix. Loved iron chef until just x worship and bug eating lmfao. Go fix yourselves lmfao,0,0,0,1684044063111249920,0
https://x.com/austwitnerd/status/1675363980364111872,Sun Jul 02 04:41:14 +0000 2023,"@jkbjournalist Big Bug, on Netflix. Very silly sci-fi movie with an extremely French sensibility.",0,0,0,1675363980364111872,0
https://x.com/vixey_voter/status/1679942164384747523,Fri Jul 14 19:53:18 +0000 2023,"@Laurie0801 oh, I'm so sorry you're sick! You get a bug?
Lincoln lawyer is good on Netflix if you haven't started that series",0,1,1,1679942164384747523,0
https://x.com/VGC_News/status/1681697731226607616,Wed Jul 19 16:09:18 +0000 2023,"A new Witcher 3 patch has been released for all platforms, introducing more content inspired by Netflix‘s series alongside bug fixes and quality of life improvements

https://t.co/kTnCELiCbJ https://t.co/evQWcE7dRh",21,112,0,1681697731226607616,0
https://x.com/toIerateit/status/1681667155702546434,Wed Jul 19 14:07:48 +0000 2023,"used to always bug one of my coworkers and be like ""how can you live without netflix?!?!?!"" i'm about to find out",0,1,1,1681667155702546434,0
https://x.com/the_fern_bug/status/1676448624233046017,Wed Jul 05 04:31:13 +0000 2023,Y’all insecure is on Netflix if u haven’t watched it pls do I have literally watched it 5 times on hbo,0,2,1,1676448624233046017,0
https://x.com/nirantakr/status/1678758710930460672,Tue Jul 11 13:30:41 +0000 2023,"@ChhabraRompy @ICICIBank_Care I am facing the same issue, tried the Netflix help center chat and they just said to use a different payment method.
@netflix @NetflixIndia is there any way to report and track a technical bug?",0,0,1,1678758710930460672,0
https://x.com/mcflyDev/status/1760790143575757145,Thu Feb 22 22:14:18 +0000 2024,"More than a journal

Create a movie of your life",5,118,0,1760790143575757145,0
https://x.com/itsAhmadHabib/status/1683919656875360256,Tue Jul 25 19:18:26 +0000 2023,"@t3dotgg Seen it happen on iPadOS 16 as well, another similar bug is when watching Netflix, sometimes this top bar wouldn't disappear",0,0,0,1683919656875360256,0
https://x.com/gingerbeardman/status/1686090527182049280,Mon Jul 31 19:04:42 +0000 2023,"BIG NEWS: I was finally able to play #Poinpy !

On Android.

It still fails to load on iOS and, judging by my experience on Android, the bug on iOS is in the multi-user picker where it asks which Adult Netflix user is about to play. 

You’re welcome, @devolverdigital cc @moppppin",0,1,2,1686090527182049280,0
https://x.com/NotAmDog/status/1685824234759569408,Mon Jul 31 01:26:33 +0000 2023,@ArkvizalVT I was watching the new Miraculous Lady Bug movie that had came out on Netflix and I was just live tweeting my reaction 😂,0,0,1,1685824234759569408,0
https://x.com/phlauxthefox/status/1678555357164060672,Tue Jul 11 00:02:37 +0000 2023,"@Coda1333 @netflix I don’t wanna bug that person rn cause they got a lot going on, otherwise I would",0,0,1,1678555357164060672,0
https://x.com/Kipotekcom/status/1755985439436005497,Fri Feb 09 16:02:08 +0000 2024,"🌬️ Shield your space from winter's chill with our Draft Blocker Door Seal! Wave farewell to unwelcome drafts and icy winds as this efficient door strip effortlessly creates a thermal barrier, guaranteeing a warm and cozy home ambiance in the winter❄️🏡
👉 https://t.co/oOUxl6XTPG https://t.co/jBh8sfHw4z",38,374,0,1755985439436005497,0
https://x.com/yuetixpasabuy/status/1680081895516934144,Sat Jul 15 05:08:32 +0000 2023,"Shop is now open! 

To order: 
Dm me on my fb acc, https://t.co/BbQkOJc40X since there's a bug in twttr rn

wts lfb ph affordable cheap spotify youtube netflix picsartgold canvapro disney+",0,0,0,1680081895516934144,0
https://x.com/chhikara1/status/1682292803299319808,Fri Jul 21 07:33:54 +0000 2023,@amit6060 Netflix caught the wokeness bug sometime back .. they haven't fully recovered... And that's a great opportunity for other Indian OTT platforms to shine.,0,2,1,1682292803299319808,0
https://x.com/inumakinq/status/1675197780170792961,Sat Jul 01 17:40:49 +0000 2023,Titans s4 ep9 is a repetition of ep7 while they have different description so im confused if they uploaded it wrong or its just a bug. pls help @netflix,0,0,0,1675197780170792961,0
https://x.com/gowler42/status/1679643289207570433,Fri Jul 14 00:05:41 +0000 2023,"@NetflixUK its always sunny in Philadelphia has disappeared from my Netflix, is this a bug or has it left?",0,1,1,1679643289207570433,0
https://x.com/safeinternetday/status/1757000180241404067,Mon Feb 12 11:14:21 +0000 2024,Check out the #AdWiseOnline report ⤵️,17,954,52,1757000180241404067,0
https://x.com/Emni_Emni/status/1677198362498539525,Fri Jul 07 06:10:25 +0000 2023,"@Kapers18 @netflix I found it very interesting. You can see it as a computer bug that can invade secure spaces, an Egyptian scarab which is a symbol of rebirth, and also as a representation of Carl Jung's golden beetle. In all three ways, it sheds light on the story.",0,1,0,1677198362498539525,0
https://x.com/matthewhjohn/status/1684795257018281984,Fri Jul 28 05:17:45 +0000 2023,"@racheljwelcher In addition to those three awesome shows, in our house we love 

 Molly of Denali (PBS)
 Sesame Street (PBS/Max)
 Gabby’s Dollhouse (Netflix)
 Pete the Cat (Amazon)
 Bug Diaries (Amazon)
 Guess How Much I Love You (Amazon)",0,2,0,1684795257018281984,0
https://x.com/GoldyRiSA/status/1680518052994072577,Sun Jul 16 10:01:41 +0000 2023,@ladyyorozu That’s not a bug; it’s an intentional copyright protection feature to prevent video recording. Netflix also does it.,0,1,0,1680518052994072577,0
https://x.com/chhikara1/status/1682294393406103552,Fri Jul 21 07:40:13 +0000 2023,"@amit6060 @netflix This is due to the wokeness bug they got infected with😅
https://t.co/svXBS4FoaB",0,1,0,1682294393406103552,0
https://x.com/ThePrimeagen/status/1683250174640914434,Sun Jul 23 22:58:09 +0000 2023,"@d0nutptr @techsavvytravvy I'm on the train back end is the only place to sanitize.

We had long standing bugs at Netflix because both front end and back end wanted to sanitize

Personal opinion",0,22,3,1683250174640914434,0
https://x.com/BobMahar/status/1681496196106317824,Wed Jul 19 02:48:28 +0000 2023,"@jackiantonovich Netflix:  Outlander, Vivarium, Invisible City,  Big Bug ( no, really! ),  The House ( animated ),  Betaal, Don't Look Up, Cunk on Earth

Prime: Good Omens, 3000 years of Longing, Evil, Upload, Tumbbad, 41, Trump vs The Illuminati ( not really, just watch the trailer )",0,1,1,1681496196106317824,0
https://x.com/awedandflawed/status/1675099495695040515,Sat Jul 01 11:10:16 +0000 2023,"@JohnHyphen I've been trying to get into it for MONTHS, literally have it sitting in front of me now, about to try some more. I know I will, I just haven't caught the bug yet. I tore through her Shadow and Bone books  after the Netflix series, so much romantic adventuring.",0,1,0,1675099495695040515,0
https://x.com/mtrantalainen/status/1680570744038621184,Sun Jul 16 13:31:03 +0000 2023,@jyzg Is that with TV integrated Netflix client? The problem looks a bit like incorrectly initialized YUV buffers so that would be a software bug or potentially flakey RAM chip or power source.,0,1,1,1680570744038621184,0
https://x.com/FollowRobinAge/status/1679394436118380545,Thu Jul 13 07:36:49 +0000 2023,"Watch these kid-friendly films about bugs &amp; creepy crawlies that are perfect for the monsoon season!

🪲 A Bug's Life - @DisneyPlusHS
🪲 Stowaways on the Ark - @YouTube
🪲 Katy Caterpillar - @YouTube
🪲 Turbo - @netflix
🪲 The Ant Bully - @PrimeVideo

https://t.co/I7lM6FHmjW",0,0,0,1679394436118380545,0
https://x.com/BD_21A/status/1678920592139997185,Wed Jul 12 00:13:56 +0000 2023,"@LadyFantastic5 That big ass bug can steal a tv remote, make popcorn, and binge watch Netflix on a couch. Then stand up and pee in a toilet 😂😂😂",0,1,1,1678920592139997185,0
https://x.com/JarretwithtwoTs/status/1679862925954273281,Fri Jul 14 14:38:26 +0000 2023,@Google pays @googledevs millions of dollars but they cant seem to fix the bug on Google Chromecast Mobile app that doesn't allow you to use the virtual remote on netflix for months. Lovely.,0,1,0,1679862925954273281,0
https://x.com/TeeJ_0_o/status/1679224630685343745,Wed Jul 12 20:22:05 +0000 2023,"@Barthazian @muratpak Now that they are no longer at @niftygateway, I wonder if @gcockfoster and @dccockfoster will ever share the story behind the Merge drop.

The bug in the contract, record breaking numbers, and drama around whether it’s art or something else.

Made for a @netflix docuseries.",0,3,0,1679224630685343745,0
https://x.com/Loteviacom/status/1760528764109246844,Thu Feb 22 04:55:41 +0000 2024,"❤️The most representative of Chinese classical intelligence toys. 🧠 Practice the brain, logical thinking ability and finger muscles.🧘 It also can cultivate the spirit of work study focused and your patience.
https://t.co/UN4Z5AFaAM https://t.co/oDZyEa6sbr",15,76,0,1760528764109246844,0
https://x.com/Blackbeard/status/1677060003570614277,Thu Jul 06 21:00:37 +0000 2023,"@wroadie F1 spoils their Netflix show every year and it bugs me. 

Just race a bunch and don’t tell anyone the results until February 2024 like how hard could it be.",0,7,1,1677060003570614277,0
https://x.com/hugoorozk077/status/1682886192679755776,Sat Jul 22 22:51:49 +0000 2023,@alifarhat79 clinton head has many bug in interface as inside job netflix.,0,2,0,1682886192679755776,0
https://x.com/avasbackwardcap/status/1679332707849863168,Thu Jul 13 03:31:32 +0000 2023,@junemoonblues it’s easy someone can just screenshare when we all get in call in the server (it’s best when their computer isn’t bad LIKE MINE so it doesn’t bug) OR NETFLIX PARTY,0,1,0,1679332707849863168,0
