link,date,text,retweet_count,favorite_count,reply_count,commentId,parentId
https://x.com/GFFN/status/1624437098844499968,Sat Feb 11 15:55:59 +0000 2023,"Breaking | Severe stomach bug continues to rip through the PSG squad - a new 1st team player was vomiting moments ago, less than 20 minutes before kick-off vs Monaco, manager Christophe Galtier tells Amazon Prime Video.",16,72,5,1624437098844499968,0
https://x.com/vinzzdemars/status/1627397588784754688,Sun Feb 19 19:59:55 +0000 2023,Y a rien qui va .. même prime vidéo bug ce soir ...,0,5,1,1627397588784754688,0
https://x.com/juliedbsn_/status/1630332501968265216,Mon Feb 27 22:22:13 +0000 2023,Mon image prime vidéo qui bug yes,0,0,1,1630332501968265216,0
https://x.com/Niima_Ronaaldo/status/1627396970837942273,Sun Feb 19 19:57:28 +0000 2023,Prime vidéo est-ce que je paye pour que ça bug toutes les 3s ? #PrimeVideo,1,3,0,1627396970837942273,0
https://x.com/ACT0RTAEHYUNG/status/1629106537812590592,Fri Feb 24 13:10:40 +0000 2023,@PrimeVideoIN I'm gonna bug you about this everyday at this point. Please update about when #JinnysKitchen would be available in prime video india?,0,1,1,1629106537812590592,0
https://x.com/gresolaa/status/1629950408922734602,Sun Feb 26 21:03:55 +0000 2023,Sto guardando Love Bugs su prime video e tutto quello che vorrei adesso è che Michelle Hunziker e Fabio De Luigi si mettessero insieme,0,2,0,1629950408922734602,0
https://x.com/MSfromUS/status/1616116086801567744,Thu Jan 19 16:51:15 +0000 2023,"Check out the best Chill Rap playlist on #Spotify 🔥 https://t.co/jOj1nxVwNQ

#chill #NewMusic2023",3133,19542,1571,1616116086801567744,0
https://x.com/SciabolataFFP/status/1622674025481662464,Mon Feb 06 19:10:10 +0000 2023,"Discreto bug, ieri, per Prime Video in Francia.
Il servizio di streaming di Amazon ha infatti ""deciso"" di espellere l'ex presidente del Montpellier, Louis Nicollin.

Il quale è morto 6 anni fa, però. 😅 https://t.co/59xTOfbVwt",1,3,0,1622674025481662464,0
https://x.com/DANGERWOMANBABY/status/1629655092042383360,Sun Feb 26 01:30:26 +0000 2023,Par contre il faut vraiment que son concert de ce soir il soit sur Prime Vidéo a un moment donnée car j’ai que des bug sur mais bon je profite quand même #TheWeekndHBO,0,0,0,1629655092042383360,0
https://x.com/bokitpapi/status/1622313485479677952,Sun Feb 05 19:17:30 +0000 2023,C’est même pas le moment de bug Prime vidéo,0,0,0,1622313485479677952,0
https://x.com/laurielbemba/status/1624460305051918337,Sat Feb 11 17:28:12 +0000 2023,C’est normal si mon Prime vidéo bug ??,0,0,0,1624460305051918337,0
https://x.com/Miguelo_972/status/1629932056414232578,Sun Feb 26 19:50:59 +0000 2023,"A chaque fois que je regarde un match sur prime vidéo, ça bug ...",0,1,1,1629932056414232578,0
https://x.com/Splatoonniene/status/1627315932975583232,Sun Feb 19 14:35:27 +0000 2023,Ce qui est chiant avec l'appli de Prime vidéo c'est qu'au moindre bug du wifi bah le son ne fait que buger après,0,0,0,1627315932975583232,0
https://x.com/Paranoimia/status/1625962273943572480,Wed Feb 15 20:56:29 +0000 2023,It really bugs me that the Prime Video app on Roku quits back to the main Roku screen if you leave it paused for more than a few minutes.,0,0,1,1625962273943572480,0
https://x.com/Az_idj/status/1628472248108564484,Wed Feb 22 19:10:14 +0000 2023,Qui sais comment on répare un bug chez prime vidéo help,0,0,1,1628472248108564484,0
https://x.com/alidsxh/status/1630325619970932738,Mon Feb 27 21:54:52 +0000 2023,"prime video ils vont me rendre ouf là, ça bug toutes les 30sec y’a pas moyen de reg un ep tranquille",0,0,0,1630325619970932738,0
https://x.com/44ocon/status/1624361725699973122,Sat Feb 11 10:56:29 +0000 2023,@prwttyfIowers il bug pcq je suis sur prime vidéo je regarde sans pb,0,0,1,1624361725699973122,0
https://x.com/LeCoinGrenat/status/1629953709017792515,Sun Feb 26 21:17:01 +0000 2023,"Prime Vidéo qui bug. On n’a plus de son, seulement ceux des commentateurs. Dommage :/",0,3,0,1629953709017792515,0
https://x.com/creadpag/status/1628890459622764545,Thu Feb 23 22:52:03 +0000 2023,Explotar AMAZON PRIME VIDEO - Bug Bounty https://t.co/SaX17kdjW0,0,3,0,1628890459622764545,0
https://x.com/dragcnflame/status/1629000135379193858,Fri Feb 24 06:07:52 +0000 2023,"https://t.co/Jlg5O5mJC2

When your mom buys puss in boots on her amazon prime video but not yours so now you cant watch it all the time. 

internally sobbing- rip. 
Maybe since its my bday soon I can bug her for it again. LOL https://t.co/dAsoyLnx3v",0,1,1,1629000135379193858,0
https://x.com/Agorafm34Fm/status/1625049418805264384,Mon Feb 13 08:29:08 +0000 2023,"Il ferait bien d'intervenir auprès de Free concernant  prime vidéo qui bug toutes les 3mn pendant 20à 30secondes à tout les matchs depuis mai 2022 !
tous ceux qui sont à sfr ou autre n'ont pas de soucis !
des centaines de gens se plaigne mais free de Niel font la sourde oreille !",0,1,0,1625049418805264384,0
https://x.com/allijr_/status/1629085310385545216,Fri Feb 24 11:46:19 +0000 2023,"top qualité / 25 secondes de retard (enlève les notifs c’est tout) / 1 petit bug toutes les 3 semaines tout ça pour 35€ a l’année et toutes les chaînes du monde y compris netflix, prime vidéo et disney +",0,0,0,1629085310385545216,0
https://x.com/RadamesOrtiz/status/1628923654108069888,Fri Feb 24 01:03:57 +0000 2023,"Tive que assinar a Paramount+ para ver os jogos da Libertadores e por enquanto só estou curtindo a equipe de transmissão, da antiga Fox/ESPN. Deu bug no app da TV na hora do jogo e no meu dongle é a pior imagem das transmissões de futebol (Star+, Prime Video, HBO Max e Globoplay)",0,0,1,1628923654108069888,0
https://x.com/stephprn23/status/1629951155739451392,Sun Feb 26 21:06:53 +0000 2023,Mon prime vidéo qui fait que bug vas-y la soirée de merde,0,0,1,1629951155739451392,0
https://x.com/ParliamoDiNews/status/1621421358465916928,Fri Feb 03 08:12:31 +0000 2023,"[VIDEO] Amazon Prime Video aggiunge Love Bugs, ma si scorda di tagliare gli spot pubblicitari
 https://t.co/umIHO5D3SF #03Febbraio #Curiosità #FilmSerieTv #AmazonPrimeVideo #LoveBugs https://t.co/vsgw1zSPLS",0,0,0,1621421358465916928,0
https://x.com/YUPLAY_COM/status/1758522274393514150,Fri Feb 16 16:02:36 +0000 2024,🎮 Still thinking about that game? 🤔 It's waiting for you at a great price on YUPLAY. Get it now! 👇,3,119,17,1758522274393514150,0
https://x.com/Julien0100/status/1629940828725555200,Sun Feb 26 20:25:51 +0000 2023,@EcuatoKamer @ToulouseFC C'est bizarre plus de chants dans le vélodrome depuis le 2-0 ??? C'est prime vidéo qui bug ?,0,4,1,1629940828725555200,0
https://x.com/caiolorena/status/1624817882860249090,Sun Feb 12 17:09:05 +0000 2023,Os bugs da Prime Vídeo são diferentes... ep 3 da 4 temporada de The Office tão com opção de legenda Filipino e Bahasa Melayu (??????),0,0,0,1624817882860249090,0
https://x.com/DavidManstra/status/1627019568500682753,Sat Feb 18 18:57:48 +0000 2023,"Ik ben nu pakweg 2 maanden geleden lid geworden van Prime Video. Kost € 3,- pm maar eigenlijk is dit 'product' een economisch delict. Zit vol met bugs: blijft hangen, slaat op tilt, sommige series, films alleen  Duitse, Engelse of Zweedse ondertitels. 100 keer tuner her gestart.",0,0,0,1627019568500682753,0
https://x.com/lacittanews/status/1621438267563311106,Fri Feb 03 09:19:42 +0000 2023,"Home Curiosità  Amazon Prime Video aggiunge Love Bugs, ma si scorda di tagliare gli spot pubblicitari     Di Marina Flocco - 3 Febbraio 2023   Amazon Prime Video continua ad espandere il suo catalogo di film, serie TV e vari altri media, e tra le

https://t.co/5loIw4bWv0 https://t.co/450xgwnYV4",0,0,0,1621438267563311106,0
https://x.com/TheHealthyGem/status/1755774598396907709,Fri Feb 09 02:04:19 +0000 2024,This quiz will determine which country you fit in with. I got France! 🥐,26,90,75,1755774598396907709,0
https://x.com/orgoglionerd/status/1620833374540529664,Wed Feb 01 17:16:04 +0000 2023,A febbraio su Prime Video arriva Love Bugs https://t.co/DdoB1gTkrj,0,2,0,1620833374540529664,0
https://x.com/AndyMRoberts/status/1624561684382683142,Sun Feb 12 00:11:03 +0000 2023,"@CRichardMichael Fortunately I have not had any hardware problems with mine, but the software is crap and full of bugs.

And I hate the way they force adverts onto the things for things like food delivery or shows on Prime Video. I OWN the thing, they should not stick adverts on something I OWN!",0,0,0,1624561684382683142,0
https://x.com/nr_oo_/status/1621200394557788165,Thu Feb 02 17:34:29 +0000 2023,"@AmazonHelp bonsoir, les rediffusions des matchs de Ligue 2 ont totalement disparu sur Prime Video. Bug technique de votre côté ?",0,0,1,1621200394557788165,0
https://x.com/MeMyselfGeminI2/status/1628371761136795650,Wed Feb 22 12:30:56 +0000 2023,"@_myheartispure Yeah had same problem with other films on Netflix. It’s not exactly available yet, most likely they are fixing some bugs or made another mistake by putting it up too early and it’s still just advertisement. If you have Prime Video see what they got going on. I been cancelled NFX.",0,0,1,1628371761136795650,0
https://x.com/LeVif/status/1623600728827625474,Thu Feb 09 08:32:33 +0000 2023,"Dans @LeVif cette semaine⁠
⁠
🎞️ Netflix, Prime Video, Disney+... Les premiers bugs du streaming⁠
🧪 Quand un laboratoire fait plonger les comptes des hôpitaux bruxellois⁠
🇹🇷 Turquie: face à la dévastation, l’exceptionnelle solidarité⁠ https://t.co/Gcoy0pLby6",4,1,2,1623600728827625474,0
https://x.com/almqnzo/status/1625145937508110336,Mon Feb 13 14:52:39 +0000 2023,"Ptdrr?? Mon père me dit que cette nuit il a eu un bug il a pu voir the last of us le debut de l’episode 6 🤣 
Il a cassé prime video 🤣🤣🤣",0,0,0,1625145937508110336,0
