link,date,text,retweet_count,favorite_count,reply_count,commentId,parentId
https://x.com/ToonHive/status/1638992838368153601,Thu Mar 23 19:55:18 +0000 2023,‘BUGS BUNNY BUILDERS’ Season 1D will premiere on HBO Max April 18. https://t.co/LXTFXzdasz,21,88,3,1638992838368153601,0
https://x.com/LooneyTerrace/status/1641494455709581312,Thu Mar 30 17:35:50 +0000 2023,"April 2023 is going to be one amazing month for the #LooneyTunes. Classic shorts on TCM, reruns of LTC on Cartoon Network plus a new batch of episodes coming to HBO Max, new episodes of Bugs Bunny Builders, and anticipation for the newest Blu-Ray coming May 30th. #LooneyTwt https://t.co/dQmoLTdkaC",40,128,7,1641494455709581312,0
https://x.com/karma_shopping/status/1748645542408700330,Sat Jan 20 09:56:00 +0000 2024,Don't overpay on Amazon again! You're welcome.,815,3359,1257,1748645542408700330,0
https://x.com/daddy2the3/status/1631881559807492097,Sat Mar 04 04:57:37 +0000 2023,"Coming to HBO Max next year from Warner Bros it's Bugs Bunny in his 1st adult animated motion picture called Buzzed &amp; Bloodshot.

#CocaineBearSequels it definitely isn't. https://t.co/wasPRfBRX5",0,4,1,1631881559807492097,0
https://x.com/LogicoolG/status/1726468393120022793,Mon Nov 20 05:11:55 +0000 2023,"【NEW】Crazy Raccoon おぼ 選手がいち早く体感！

世界のトップ選手と共同開発したLogicoolG PROシリーズから、
新登場した、さらにハイエンドな「PRO X シリーズ」の
リアルな感想を動画でチェック

▼画像タップで、動画本篇へ▼",384,3809,323,1726468393120022793,0
https://x.com/NirmalSBhansali/status/1633412865221857280,Wed Mar 08 10:22:29 +0000 2023,"All those who are now planning to torrent HBO shows, my sincere suggestion is to use Transmission as your torrent client. 

Bug free. No ads. Light on the system.",0,38,4,1633412865221857280,0
https://x.com/WakkoKing/status/1639017132196352000,Thu Mar 23 21:31:50 +0000 2023,New episodes of Bugs Bunny Builders are coming to HBO Max in April https://t.co/4iLc31JLfY,2,8,1,1639017132196352000,0
https://x.com/n00tulain/status/1635788923292250114,Tue Mar 14 23:44:05 +0000 2023,it is time to bug @hbo til brown girls is released,0,0,1,1635788923292250114,0
https://x.com/MSfromUS/status/1712866182259245298,Fri Oct 13 16:21:36 +0000 2023,"Check out Hip Hop &amp; R&amp;B Duets playlist on Spotify: https://t.co/654mXxcQbn

#hiphop #duets",533,5703,402,1712866182259245298,0
https://x.com/rynbread/status/1636511307250778112,Thu Mar 16 23:34:35 +0000 2023,why wont hbo let mex subscribe its been like a couple of days n the bug isnt fixed yet 💀,0,0,0,1636511307250778112,0
https://x.com/thelastoflink/status/1632602780056580097,Mon Mar 06 04:43:29 +0000 2023,"I get that they don't want actors hanging out in a burning down set but like it kinda bugs me that HBO didn't really get the David scene right. 
It just felt way too rushed. Idk, maybe I've just played the game way too many times 🤷🏼",0,0,0,1632602780056580097,0
https://x.com/brcoluis/status/1635092939180507137,Mon Mar 13 01:38:29 +0000 2023,hbo max culiao bug,0,1,0,1635092939180507137,0
https://x.com/LooneyTerrace/status/1639993222263971840,Sun Mar 26 14:10:28 +0000 2023,"The only missing #LooneyTunes Cartoons short shown at Annecy, “Sick as a Hare” with Bugs and Elmer has not been in any package since it premiered on HBO Max in 2020. It’s most likely been shelved ever since the COVID-19 pandemic and it may be considered lost. #LooneyTwt",4,15,1,1639993222263971840,0
https://x.com/kimweets/status/1639800218236465154,Sun Mar 26 01:23:32 +0000 2023,"The best new shows on HBO and HBO Max in April is no doubt highlighted by the final season of Bill Hader's Barry , television's best dark comedy about an assassin who catches the acting bug. https://t.co/7xRCTxXqnD … #news https://t.co/DLCYWaKvoz",0,0,0,1639800218236465154,0
https://x.com/eunaosoueuta/status/1632774938997161988,Mon Mar 06 16:07:35 +0000 2023,HBO gasta todo o orçamento fazendo séries ótimas mas não deixa um restinho pra consertar esse app cheio de bug,0,5,2,1632774938997161988,0
https://x.com/amaisfufu/status/1635316520367816707,Mon Mar 13 16:26:55 +0000 2023,Perdendo minutos de série por conta desse bug do caralho da HBO,0,0,0,1635316520367816707,0
https://x.com/goldman/status/1633884043082346498,Thu Mar 09 17:34:46 +0000 2023,I renew once again my demand to be made Secretary of Streaming. I will standardize the UX across the streaming apps and also deal with things like HBO Max reloading mid selection. Having closed these bugs I will resign.,0,39,6,1633884043082346498,0
https://x.com/nego3xnego/status/1638732022968463360,Thu Mar 23 02:38:55 +0000 2023,"Que bug, tava procurando avengers na hbo",0,0,0,1638732022968463360,0
https://x.com/Rellyy_L/status/1632532287618179072,Mon Mar 06 00:03:23 +0000 2023,"Odio desse bug do app da HBO, o filme tá saindo só em inglês e sem legenda.",0,0,0,1632532287618179072,0
https://x.com/Edisley_Lima/status/1635008091791179778,Sun Mar 12 20:01:20 +0000 2023,TLOU + OSCAR : Bug da HBO 😢,0,1,0,1635008091791179778,0
https://x.com/Colormedeadang1/status/1633315537802661891,Wed Mar 08 03:55:44 +0000 2023,Why hasn’t a live action movie of Elmer Fudd &amp; Bugs Bunny been made? Starring @DannyDeVito Devito as Fudd &amp; @McConaughey as Bugs. Alright. Alright. Alright. @HBO have your people call my people.,1,1,0,1633315537802661891,0
https://x.com/gxtzaecremosa/status/1638342487738576901,Wed Mar 22 00:51:02 +0000 2023,Esse aplicativo da HBO é um bug por minuto,0,0,0,1638342487738576901,0
https://x.com/Greyoutt/status/1634775590128476160,Sun Mar 12 04:37:28 +0000 2023,"If HBO Max is getting its name changed, they should change it to Rabbit Hole and have Bugs Bunny as the logo.",0,0,0,1634775590128476160,0
https://x.com/TheHealthyGem/status/1755774598396907709,Fri Feb 09 02:04:19 +0000 2024,This quiz will determine which country you fit in with. I got France! 🥐,25,85,72,1755774598396907709,0
https://x.com/issoai_ne/status/1638374023011729408,Wed Mar 22 02:56:21 +0000 2023,"eu odeio o aplicativo da hbo, só dá problema, eu fazia um app com menos bug",0,0,0,1638374023011729408,0
https://x.com/AnimationOnMax/status/1638967242384605184,Thu Mar 23 18:13:35 +0000 2023,"Season 1D of ""BUGS BUNNY BUILDERS"" is coming to HBO Max on April 18! #LooneyTunes #Cartoonito https://t.co/g8KqGu0FdF",2,11,1,1638967242384605184,0
https://x.com/anclarap/status/1638032835108917249,Tue Mar 21 04:20:35 +0000 2023,"me dá um ódio quando a Globo play da esses bug, sdds da HBO, Disney plus, star+🤯 preciso do meu computador urgente",0,1,1,1638032835108917249,0
https://x.com/vitorwave_/status/1639844523722276865,Sun Mar 26 04:19:35 +0000 2023,recentemente descobri um bug na @HBO que possibilidade assistir coisas de graça.,0,1,0,1639844523722276865,0
https://x.com/ce_sagita/status/1632893765844074497,Mon Mar 06 23:59:46 +0000 2023,Odeio quando essa plataforma da HBO começa a da bug 😡,0,0,0,1632893765844074497,0
https://x.com/diadesol/status/1632658501695578116,Mon Mar 06 08:24:54 +0000 2023,"gente minha hbo max nunca travou, não sabia que ela dava esses bug que eu tô vendo no tt não",0,0,0,1632658501695578116,0
https://x.com/aniqueirozz/status/1635103550719270912,Mon Mar 13 02:20:39 +0000 2023,Os bugs da hbo na transmissão,0,0,0,1635103550719270912,0
https://x.com/WiCnet/status/1631746435392716801,Fri Mar 03 20:00:41 +0000 2023,The Last of Us breaks into the billion-minutes-watched club a few weeks after its debut. HBO is bringing back the zombie bug. https://t.co/PVBDN80gmG,1,19,0,1631746435392716801,0
https://x.com/ekanscisum/status/1719011081664831493,Mon Oct 30 15:19:14 +0000 2023,"I really love this hip hop road trip playlist: https://t.co/TFsscitE7N

#hiphop #roadTrip",660,6865,395,1719011081664831493,0
https://x.com/LooneyTerrace/status/1639021194572701698,Thu Mar 23 21:47:58 +0000 2023,"In addition to new Bugs Bunny Builders episodes premiering April 17th on Cartoon Network, they will all be on HBO Max the day after. Here’s a clip from the episode “Cousin Billy”, Daffy’s new cousin specially written for the show. #LooneyTunes #LooneyTwt

https://t.co/TsrHxqIP74",4,12,0,1639021194572701698,0
https://x.com/dracarysneles/status/1641845277983113230,Fri Mar 31 16:49:52 +0000 2023,"fazem 3 dias que o meu hbo max está bugado, já entrei por todas as plataformas possível e continuar o mesmo bug, sem atualizar a tela e mostrar o ep ou filme que eu assisto, não consigo voltar em nada que estava vendo porque ele simplesmente não marca mais isso @HBOMaxBR resolvam",0,0,2,1641845277983113230,0
https://x.com/bia_mrss/status/1637413578377502720,Sun Mar 19 11:19:53 +0000 2023,é inacreditável q a hbo esteja com bug e eu nao va conseguir ver mais nenhum conteúdo sem ser legendado (e em apenas portugues de portugal) vai tomar no cu,0,0,0,1637413578377502720,0
https://x.com/bug_thesda/status/1634956258087432192,Sun Mar 12 16:35:22 +0000 2023,@Neil_Druckmann @BellaRamsey @TheLastofUsHBO @Naughty_Dog @HBO https://t.co/gOJNZEoPTT,0,0,0,1634956258087432192,0
https://x.com/ricky_polite/status/1631716220746571778,Fri Mar 03 18:00:37 +0000 2023,@sydney_bug Lol... Wrong Convo.  Yea. I'm telling you watch the Documentary on HBO Max or do some Research. This isn't about just some Murder. It actually seems Justice for people Victimized by this Crazy  Family.,0,0,1,1631716220746571778,0
https://x.com/bug_thesda/status/1634954614444560386,Sun Mar 12 16:28:50 +0000 2023,@HBO https://t.co/hOG3smUtwR,0,0,0,1634954614444560386,0
https://x.com/_mistressofdark/status/1637635049095831552,Mon Mar 20 01:59:56 +0000 2023,"Queria saber como o conseguem AINDA deixar o aplicativo da HBO max HORROROSO até HOJE sendo que é simplesmente o melhor catálogo de streaming é um dos mais procurados, entra ano e sai ano essa bosta é cheia de BUG! Pqppppp EH SÓ ARRUMAR SABE…",0,0,1,1637635049095831552,0
https://x.com/AsMidiasQuentes/status/1632597954287607810,Mon Mar 06 04:24:19 +0000 2023,"@danzer0 @hbomax @HBOMaxSuporte @HBOMaxBR Já fiz uma explicação sobre isso por aqui no lançamento da HBO Max. Esse bug é antigo. Dá pra resolver.
Vou ver se acho aqui.",0,0,2,1632597954287607810,0
https://x.com/spongieupdates/status/1631708047574695959,Fri Mar 03 17:28:08 +0000 2023,"@cutemewmew I agree. Plus once and hopefully when the new HBO Max successor releases things will start to pick up there too. The Cartoonito hub on HBO Max is a mess. It just has cheap content from Moon Bug, some Sesame Street content, old HBO preschool content, and 2 original programs.",1,1,1,1631708047574695959,0
https://x.com/JesusHyoga/status/1635388827262152705,Mon Mar 13 21:14:15 +0000 2023,"@BenjiSales And a spin off. And lot of people was still mad at HBO for Thrones finale. And with the finale season a other episodes leaked before official release. HOTD S2 will be even more massive. Anyways, bug W for HBO and Warner Discovery I guess.",0,2,0,1635388827262152705,0
https://x.com/AGuyInChair/status/1633243173290999808,Tue Mar 07 23:08:11 +0000 2023,"@hbo_barry @realalecberg @WarnerMedia The cast also gets guest invites to the event. Playfully bug them too. (Always be kind.)

Do this obsessively for the next three weeks straight and you might unlock it.",0,2,0,1633243173290999808,0
https://x.com/Blank_Notebook/status/1641149692951003147,Wed Mar 29 18:45:52 +0000 2023,"2/2 The HBO series... 😅 What's done it's done, and there will always be bugs and patches. But what I've seen it's bad. 😕 Hope people understand too that these things happen and at least there will be a patch (hopefully soon enough).",0,0,0,1641149692951003147,0
https://x.com/YUPLAY_COM/status/1753435856952606809,Fri Feb 02 15:11:00 +0000 2024,"Unlock 2024's hottest game releases so far at unbeatable prices on YuPlay. Play more, spend less!",8,118,36,1753435856952606809,0
https://x.com/karmacakedotca/status/1635102432765313025,Mon Mar 13 02:16:13 +0000 2023,"@jeff_goldenberg @BruceJVail YOOOOOOOOOOOO... That was unpreparedness on the interviewers behalf. She put an assumption on Hugh Grant based on a cameo - I feel for her. Likely she was not expecting to see him on the carpet, but that's when she needs a bug HBO just released a teaser for The Palace...",0,0,1,1635102432765313025,0
https://x.com/rdominguez_108/status/1641464269278441472,Thu Mar 30 15:35:53 +0000 2023,"@CoolPurpleBass @KarossoBR @Naughty_Dog They should of have more time in fixing the bugs and optimization issues after the game's first delay to March 28th, but this is what we got now.

They rushed it, thanks to the HBO show as it's been over two weeks since the Season 1 finale.",0,0,0,1641464269278441472,0
https://x.com/BrunoMR2002/status/1632204578618851328,Sun Mar 05 02:21:11 +0000 2023,"@EdwardSabaVO This should release on Bluray DvD and Digital instead in HBO Max if they don't want any of those things in HBO Max but we still hate the one who runs the company (no not Bugs he's great, the person who keeps cancelling the newest animation projects).",0,0,0,1632204578618851328,0
https://x.com/trescoma14_lar/status/1632661539281940481,Mon Mar 06 08:36:59 +0000 2023,"Compre hbo plus por un mes pero no me saco plata de la uala, aprovecha el bug(?",0,0,0,1632661539281940481,0
https://x.com/MSfromUS/status/1695123276572344425,Fri Aug 25 17:17:37 +0000 2023,"Check out Neo Soul Greatest Hits playlist on Spotify: https://t.co/izDgaUVO9W

#neosoul",588,7987,301,1695123276572344425,0
https://x.com/evocb/status/1633303958075604995,Wed Mar 08 03:09:43 +0000 2023,"@HBOMaxBR Poxa o App da HBO na Tv tá muito ruim, vários bugs e lento.. tem q rever isso aí com a galera da TI 🫶",0,0,1,1633303958075604995,0
https://x.com/queen_ks2/status/1638034408325169154,Tue Mar 21 04:26:50 +0000 2023,"@fatouoficial Quando eu tinha HBO Max sofria demais pra conseguir usar o site 😥

Tinha uns bugs que nunca tinha visto acontecer",0,0,0,1638034408325169154,0
https://x.com/MostRandomish/status/1634653402905837572,Sat Mar 11 20:31:56 +0000 2023,"@DiscussingFilm That’s what happens when you buy and consolidate too many companies that have 0 similarities. Seriously, the only common denominator is a bunny. WB has Bugs Bunny, Discovery has real bunnies, and HBO has real hookers on the Bunny Ranch. Maybe they should call it BunnyMax.",0,0,0,1634653402905837572,0
https://x.com/american_bug/status/1634507683955892224,Sat Mar 11 10:52:54 +0000 2023,"@xyodrea dark (only watch sub) 
castlevania (genuinely one of the best dub animes ever made if not the best) 
house of cards (first netflix original on par with any hbo show) 
cyberpunk edgerunners (also try out altered carbon if you like the genre)
narcos (no comment, just amazing)",0,1,1,1634507683955892224,0
https://x.com/TheQuillBot/status/1703720519814492480,Mon Sep 18 10:40:00 +0000 2023,"Do you want to communicate more clearly at work? Try QuillBot. It's an online writing platform that can instantly make your written communication concise and professional. Plus, you can optimize your tone to ensure you're connecting with your audience. Try QuillBot today.",223,2826,177,1703720519814492480,0
https://x.com/PrinConsuella_/status/1631558360897052672,Fri Mar 03 07:33:20 +0000 2023,"@jess_starlinz @vampvo @Tomas_Mier @theweeknd @RollingStone @HBO They do! But woke people can't figure that out. If tomorrow RS say ""bugs bunny was an abused"", they'll be all over trying to cancel a Cartoon.",0,1,1,1631558360897052672,0
https://x.com/Jayme66274386/status/1633229813979783170,Tue Mar 07 22:15:06 +0000 2023,"@HBOMaxSuporte Ah vcs nao querem q eu tenha a melhor experiência, nao msm, senao ja teriam resolvido esse bug a tempos atrás, ja reclamei aqui diversas vezes e sempre acontece a msm coisa, mas agora vcs conseguiram EU DESISTO DA HBO. UMA PORCARIA DE APP.",0,0,1,1633229813979783170,0
https://x.com/MediaBlotter/status/1634601980646813696,Sat Mar 11 17:07:36 +0000 2023,Best Supporting Actress nominee Kerry Condon got the horse bug while working on 2011-12 HBO Series LUCK and just recently bought a farm near Seattle. She currently owns nine rescue horses. https://t.co/P0mIMJdAxF,0,0,0,1634601980646813696,0
https://x.com/HistoryVareck/status/1638974761542774805,Thu Mar 23 18:43:28 +0000 2023,"@SweatimusPrime It wasn't as common as Jap but it was common enough to be the title of a bugs bunny cartoon and I believe it was used in HBO's The Pacific 
Idk about the clip",0,1,2,1638974761542774805,0
https://x.com/SidiousStrange/status/1635035545536729089,Sun Mar 12 21:50:26 +0000 2023,@ThatChrisEvans0 I googled it. The ad supported streaming platforms for Roku and Tubi. And rumor has it they plan to move other premium series off of HBO Max to ad based platforms in the future. Really bugs me. Part of what I pay HBO for is to have access to their library of series.,0,1,0,1635035545536729089,0
https://x.com/BazanLucas_/status/1632560472196087810,Mon Mar 06 01:55:22 +0000 2023,"@BadFeminista Disney+ es la única que le hace pelea. HBO es ineficiente como la mierda. Súper mal optimizada (a veces ni carga), lenta, tosca y llena de bugs",0,1,2,1632560472196087810,0
https://x.com/WakkoKing/status/1639273176529092610,Fri Mar 24 14:29:16 +0000 2023,"@wiley207 Looney Tunes will be airing on both Cartoon Network and TCM, new episodes of Looney Tunes Cartoons and Bugs Bunny Builders will be on HBO Max",0,2,0,1639273176529092610,0
https://x.com/freejay/status/1634639643571552257,Sat Mar 11 19:37:15 +0000 2023,"@EricRogersHere @BittrScrptReadr You guys. The Fugitive is on HBO. It is, as you know, perfect. I put it on for background as I cleaned- Nope. It’s gravity pulls you right in. Every rewatch is a reward. Thanks for putting the bug in my head. Perfect.",0,1,1,1634639643571552257,0
https://x.com/Leegado/status/1635117861017628674,Mon Mar 13 03:17:31 +0000 2023,"@SrFrediericksen Faz quase um ano que assinei HBO e desisti em menos de uma semana, assim que percebi esses bugs. 
Pelo visto ainda não solucionaram.",0,1,1,1635117861017628674,0
https://x.com/Pitzcozinho/status/1636540711784022016,Fri Mar 17 01:31:25 +0000 2023,@gera_lopes @AnnaS_Gdottir @edmann @banbannon @Gioeela @BrunoTricolorSP @AdrianaHlobo @Tweetando12 @Quiz__real @esquerdeando @vicente_rubem @Givonete4 @alvaroluizcunha @Adriana93673435 @adrianarqvieira @LuciabritoAna @JPereiraLeal @desertodeamor @FMSaboia @ramiroda_s1 @roaraz @che_zl @quiz__ @GSturban @HerisValmir @Fern20Mendes @EiHenderson @MaRosario1967 @PiticoDomal666 @Lelecoutz @Fabiomarbinho @cajaranabs @jtcmoreira @pvs_jorge @gechelle @RnSaboia @JaqueVenturini1 @EUCEANO_ORG Deu Teto Preto hoje no streaming da HBO dava só bug,0,2,1,1636540711784022016,0
