content,title,commentId,parentId,upVotes,date,link
"Will try ! Hdr is so annoying sadly on Netflix and even other media like Instagram and closely Chrome soon.

Hdr should be an improvement but today on Android it's a pain.",,k46p3kg,16w46m5,1,2023-10-09 22:08:59,https://www.reddit.com/r/netflix/comments/16w46m5/tip_how_to_turn_off_hdr_video_playback_on/k46p3kg
Is there a step by step guide for people with not knowing about ADB?,,k9w05gc,16w46m5,1,2023-11-19 13:47:28,https://www.reddit.com/r/netflix/comments/16w46m5/tip_how_to_turn_off_hdr_video_playback_on/k9w05gc
Maybe? I don't have an android tv so I can't test it.,,k38cvyn,k36i4xe,1,2023-10-03 03:30:40,https://www.reddit.com/r/netflix/comments/16w46m5/tip_how_to_turn_off_hdr_video_playback_on/k38cvyn
Works Well !! Insane,,k48xay7,k46p3kg,1,2023-10-10 09:04:48,https://www.reddit.com/r/netflix/comments/16w46m5/tip_how_to_turn_off_hdr_video_playback_on/k48xay7
"Video is choppy after about five minutes. It did not matter if the video was streaming on wifi, downloaded, auto rotate on or off, brightness, low or high battery level, full screen or the tiny app window. The video stayed synced with the audio but the video was choppy. Android os. Updated the app and restarted phone. 

The only that that stopped the choppy was plugging the phone in regardless of battery level.

What is causing this? A setting on my side? A general bug?","Choppy video on app until plugged in, what setting did this?",14vi43j,0,0,2023-07-10 04:09:39,https://www.reddit.com/r/netflix/comments/14vi43j/choppy_video_on_app_until_plugged_in_what_setting/
it could be the battery saver or battery optimization setting. when enabled it limits the hardware on your device when running on battery so that it will last longer.,,jre1dw0,14vi43j,1,2023-07-10 12:20:08,https://www.reddit.com/r/netflix/comments/14vi43j/choppy_video_on_app_until_plugged_in_what_setting/jre1dw0
Never had that issue before but did turn off adaptive battery. Battery share and battery saver always been off!,,jrf0za2,jre1dw0,1,2023-07-10 17:01:53,https://www.reddit.com/r/netflix/comments/14vi43j/choppy_video_on_app_until_plugged_in_what_setting/jrf0za2
"I recently made it so that google forgets all my cookies, for storage reasons, and I forgot to take into consideration the fact that my netflix was going to be disconnected too. Lucky for me, the netflix application on my computer is installed, but the quality is WAYY too grainy. Its like they took the film grain effect and boosted it up to 11, with lots of sharpness too. I can overlook it, but it still kinda bugs me, since the netflix website has pretty clear HD quality. Is it just for me or is it for you too?",Is the Netflix app on PC too grainy or is it just for me?,18oo54n,0,1,2023-12-22 20:29:15,https://www.reddit.com/r/netflix/comments/18oo54n/is_the_netflix_app_on_pc_too_grainy_or_is_it_just/
"  Netflix Began as a company in 1997 but as a streaming service only started producing original content in 2012. At the time that didn't matter because Netflix was able to sign many exclusive contracts with companies like Sony, Warner Bros, Viacom, etc to stream their ip's including breaking bad, south park, Batman, Cowboy Bebop, etc. The problem is recently these companies created their own streaming services so naturally they wanted their IP's as a draw and began removing them from Netflix. Most of these companies have many decades over Netflix when it comes to creating content: Warner Bros for example started 100 years ago and produced extremely recognizable IP's like Bugs bunny. Netflix on the otherhand doesn't have this massive back catalogue of originals to fall back on and is forced to come up with as many originals as possible hoping one will be the next Stranger things or use create partnerships with other IP holders to create spinoffs like Cowboy Bebop, The Adams Family, or Avatar. 

  To make matters worse Netflix never began the process of consolidation like some companies such as Disney with it's purchases of Star Wars, Marvel and Fox studios or HBO and Warner bros. Netflix needs to create temporary partnerships that may or may not be longstanding(think cowboy bebop), Contrast this to the many new Batmans, Star Wars, Supermans, Looney Tunes, Harry potter, these are massive franchises that can be expanded in ways Netflix can't do. 

  So To summarize Netflix has about ten years of original content to fall back on while Warner Bros/Disney have over 100 years worth of back content, Netflix appears often times to have nothing to watch because compared to many creators in genuinly doesn't. ",The Real Reason It Often Feels Like There's Nothing On Netflix,18v14ot,0,0,2023-12-31 06:08:35,https://www.reddit.com/r/netflix/comments/18v14ot/the_real_reason_it_often_feels_like_theres/
"dude they have **18200 titles to watch**, you just can\`t find all because you going in circles.",,kfodtjf,18v14ot,27,2023-12-31 08:41:24,https://www.reddit.com/r/netflix/comments/18v14ot/the_real_reason_it_often_feels_like_theres/kfodtjf
I always find something to watch on Netflix. As I have a bunch of stuff to watch on Netflix,,kfoudnm,18v14ot,9,2023-12-31 12:12:35,https://www.reddit.com/r/netflix/comments/18v14ot/the_real_reason_it_often_feels_like_theres/kfoudnm
Sure it isn't that you just need to leave the house more?,,kfo9387,18v14ot,12,2023-12-31 07:43:44,https://www.reddit.com/r/netflix/comments/18v14ot/the_real_reason_it_often_feels_like_theres/kfo9387
"Na, theres literally millions of hours of movies and documentaries, 10s of millions of hours of TV shows, both original content and licensed content. If you cant find something to watch says more about you than the service.",,kfoa6jy,18v14ot,12,2023-12-31 07:56:47,https://www.reddit.com/r/netflix/comments/18v14ot/the_real_reason_it_often_feels_like_theres/kfoa6jy
Brain dead post,,kfq1lhh,18v14ot,2,2023-12-31 17:44:13,https://www.reddit.com/r/netflix/comments/18v14ot/the_real_reason_it_often_feels_like_theres/kfq1lhh
"The reason isn't because they don't have IP, but because their originals are crap. Releasing 1000 crappy movies every month won't encourage people to watch more Nerflix.

They should focus less on aquiring IP (e.g. Witcher), and focus more on actually getting talented showrunners. After years of failing, maybe people who advocate for competent > diversity are right.",,kfoo1qz,18v14ot,0,2023-12-31 10:53:44,https://www.reddit.com/r/netflix/comments/18v14ot/the_real_reason_it_often_feels_like_theres/kfoo1qz
"""Cowboy Bebop"" sounds so stupid as a title. Is it really a good show like people say?",,kfoj9a3,18v14ot,-1,2023-12-31 09:51:07,https://www.reddit.com/r/netflix/comments/18v14ot/the_real_reason_it_often_feels_like_theres/kfoj9a3
"Cowboy bebop was terrible. You might be right on the rest. They have very little that's any good.

They need to create some more original IP.",,kfprozz,18v14ot,0,2023-12-31 16:40:57,https://www.reddit.com/r/netflix/comments/18v14ot/the_real_reason_it_often_feels_like_theres/kfprozz
My To-Watch list is so long,,kg8a99r,18v14ot,1,2024-01-04 03:35:15,https://www.reddit.com/r/netflix/comments/18v14ot/the_real_reason_it_often_feels_like_theres/kg8a99r
Most of it bad.,,kfprs20,kfodtjf,4,2023-12-31 16:41:30,https://www.reddit.com/r/netflix/comments/18v14ot/the_real_reason_it_often_feels_like_theres/kfprs20
I meant in the recognizable IP sense they have to pile out a lot of bad content no one watches because they don't have the massive back catalogue other companies have,,kfofppa,kfodtjf,-7,2023-12-31 09:05:27,https://www.reddit.com/r/netflix/comments/18v14ot/the_real_reason_it_often_feels_like_theres/kfofppa
You likely also don’t have other choices.,,kfp41x7,kfoudnm,-5,2023-12-31 13:50:31,https://www.reddit.com/r/netflix/comments/18v14ot/the_real_reason_it_often_feels_like_theres/kfp41x7
House of Dragons.,,kfp3nue,kfo9387,1,2023-12-31 13:47:07,https://www.reddit.com/r/netflix/comments/18v14ot/the_real_reason_it_often_feels_like_theres/kfp3nue
I agree we should all cancel our Netflix and go outside,,kfobzvq,kfo9387,-5,2023-12-31 08:18:43,https://www.reddit.com/r/netflix/comments/18v14ot/the_real_reason_it_often_feels_like_theres/kfobzvq
Yes but most of it has terrible reviews and is critically panned they have to put out a massive amount because they don't have the long lasting legacy content like Disney or Warner bros everyone knows who bugs bunny or mickey mouse is Netflix just doesn't have those time tested classics so it's forced to output a ton of mediocre content Disney has star wars a loved and cherished classic Netflix has rebel moon knock of in many ways as an example,,kfoau43,kfoa6jy,-2,2023-12-31 08:04:36,https://www.reddit.com/r/netflix/comments/18v14ot/the_real_reason_it_often_feels_like_theres/kfoau43
Most of which is terrible.  Just bc someone makes a documentary doesn’t mean it’s worth watching.,,kfp3qw0,kfoa6jy,-1,2023-12-31 13:47:51,https://www.reddit.com/r/netflix/comments/18v14ot/the_real_reason_it_often_feels_like_theres/kfp3qw0
Brain dead comment,,kfq6a6v,kfq1lhh,2,2023-12-31 18:13:32,https://www.reddit.com/r/netflix/comments/18v14ot/the_real_reason_it_often_feels_like_theres/kfq6a6v
"The original anime has a cult following its definitely worth a watch, the title refers to the ship but also the heavy use of jazz and folk guitar throughout.",,kfomdzk,kfoj9a3,5,2023-12-31 10:31:53,https://www.reddit.com/r/netflix/comments/18v14ot/the_real_reason_it_often_feels_like_theres/kfomdzk
"The anime was highly popular in America, not so much in Japan. I genuinely like the Live action adaptation, but it got canceled. Its a space gunslinger show in the same vein as Firefly/Serenity.",,kfoqzrp,kfoj9a3,4,2023-12-31 11:31:26,https://www.reddit.com/r/netflix/comments/18v14ot/the_real_reason_it_often_feels_like_theres/kfoqzrp
"I have not yet seen someone refer to ""Cowboy Bebop"" as a good show",,kfolaay,kfoj9a3,1,2023-12-31 10:17:27,https://www.reddit.com/r/netflix/comments/18v14ot/the_real_reason_it_often_feels_like_theres/kfolaay
We were talking about everyone else,,kg8ap9o,kg8a99r,1,2024-01-04 03:38:21,https://www.reddit.com/r/netflix/comments/18v14ot/the_real_reason_it_often_feels_like_theres/kg8ap9o
[deleted],,kfofwhm,kfofppa,8,2023-12-31 09:07:50,https://www.reddit.com/r/netflix/comments/18v14ot/the_real_reason_it_often_feels_like_theres/kfofwhm
"Pluto, Tubi, crackle,freefvee or however there's spelled, Paramount Plus, Hulu free through phone plan, prime video etc",,kfq8kx6,kfp41x7,2,2023-12-31 18:27:27,https://www.reddit.com/r/netflix/comments/18v14ot/the_real_reason_it_often_feels_like_theres/kfq8kx6
But I find myself mostly drawn to the things that I have to watch on Netflix because there's so much continuation that's going on in regards to TV shows and anime that I'm watching. A lot of times I just I don't have time for these other things except for the free ones like you know I'll pop on Hulu and I'll watch Sanford and son No that's not no I'll watch the Addams family or Beverly hillbillies you know a few episodes and whatnot,,kfq8q7q,kfp41x7,1,2023-12-31 18:28:19,https://www.reddit.com/r/netflix/comments/18v14ot/the_real_reason_it_often_feels_like_theres/kfq8q7q
Great show,,kfpbblp,kfp3nue,2,2023-12-31 14:49:40,https://www.reddit.com/r/netflix/comments/18v14ot/the_real_reason_it_often_feels_like_theres/kfpbblp
">Yes but most of it has terrible reviews and is critically panned

I assume you can prove this statement, but knowing you cant, we can end the convo here.",,kfocjq3,kfoau43,9,2023-12-31 08:25:28,https://www.reddit.com/r/netflix/comments/18v14ot/the_real_reason_it_often_feels_like_theres/kfocjq3
Robin Williams,,kfomeza,kfolaay,2,2023-12-31 10:32:16,https://www.reddit.com/r/netflix/comments/18v14ot/the_real_reason_it_often_feels_like_theres/kfomeza
Yes but they're also putting out good content like the sopranos and the wire Netflix is putting out groomer content like cuties. Disney had the actual star wars Netflix has the knock off rebel moon,,kfog7rp,kfofwhm,-10,2023-12-31 09:11:50,https://www.reddit.com/r/netflix/comments/18v14ot/the_real_reason_it_often_feels_like_theres/kfog7rp
"So you are comparing garbage content to Netflix.  So as I stated you no choices.  In turn that inflates your distorted view Netflix content is good, above average or any other term you want to use.",,kfq9npq,kfq8kx6,-1,2023-12-31 18:33:54,https://www.reddit.com/r/netflix/comments/18v14ot/the_real_reason_it_often_feels_like_theres/kfq9npq
Every once in awhile those free ones have gems I watched the road and the early 2000s spiderman for the first time on Tubi,,kfqd677,kfq8kx6,1,2023-12-31 18:54:52,https://www.reddit.com/r/netflix/comments/18v14ot/the_real_reason_it_often_feels_like_theres/kfqd677
"> Yes but most of it has terrible reviews and is critically panned

Massive overstatement. You just seem to be hinging your entire argument around Rebel Moon’s recent poor critical reception.

Netflix still has plenty of recognisable franchises, and critically well received series’.",,kfok2wa,kfocjq3,6,2023-12-31 10:01:46,https://www.reddit.com/r/netflix/comments/18v14ot/the_real_reason_it_often_feels_like_theres/kfok2wa
"Nah pretty easy to prove I'm right just typing a list of the greatest TV shows into Google the first article brings HBO shows at number 1 and 4 with no Netflix originals in sight 
https://www.rollingstone.com/tv-movies/tv-movie-lists/best-tv-shows-of-all-time-1234598313/
Also critics pan rebel moon one of the first things yo come up 
https://www.forbes.com/sites/conormurray/2023/12/28/rebel-moon-tops-netflix-charts-but-critics-pan-zack-snyders-massive-franchise-ambitions/",,kfog2ud,kfocjq3,-1,2023-12-31 09:10:05,https://www.reddit.com/r/netflix/comments/18v14ot/the_real_reason_it_often_feels_like_theres/kfog2ud
Sopranos and the wire were about 20 years ago or more…,,kfomy2l,kfog7rp,5,2023-12-31 10:39:14,https://www.reddit.com/r/netflix/comments/18v14ot/the_real_reason_it_often_feels_like_theres/kfomy2l
[deleted],,kfoghyt,kfog7rp,8,2023-12-31 09:15:28,https://www.reddit.com/r/netflix/comments/18v14ot/the_real_reason_it_often_feels_like_theres/kfoghyt
You further illustrate my point.,,kfqq455,kfqd677,3,2023-12-31 20:12:23,https://www.reddit.com/r/netflix/comments/18v14ot/the_real_reason_it_often_feels_like_theres/kfqq455
"Not really honestly rebel moon is a compliment compared to some of the stuff Netflix puts out Netflix has consistently been accused of grooming because of stuff like cuties and battle kitty both have been accused of grooming if anything rebel moon is Netflix better stuff which really goes to show how bad it really is i mean look at what Netflix did to cowboy bebop, critics absolutely hated that so much they had to cancel it after one season on s cliffhanger",,kfom192,kfok2wa,-1,2023-12-31 10:27:12,https://www.reddit.com/r/netflix/comments/18v14ot/the_real_reason_it_often_feels_like_theres/kfom192
"It shouldn't need to be said, but not being on the ""greatest TV shows"" list doesn't mean you got bad reviews. Most shows aren't on the list of ""greatest TV shows"".",,kfon38b,kfog2ud,6,2023-12-31 10:41:07,https://www.reddit.com/r/netflix/comments/18v14ot/the_real_reason_it_often_feels_like_theres/kfon38b
"Not really man I'm just explaining Netflix's business strategy this is stuff they themselves say, 100% they prioritize quantity over quality because they don't have the massive franchises (Harry Potter, DC, Marvel, Star wars, Simpsons, etc) or critically applauded shows(sopranos, the wire, game of thrones) that other companies have they rely on people being willing to defend an inferior product due to company loyalty",,kfogyxc,kfoghyt,-4,2023-12-31 09:21:27,https://www.reddit.com/r/netflix/comments/18v14ot/the_real_reason_it_often_feels_like_theres/kfogyxc
Cormac McCarthy? The road was an extremely influential work. Last of us creator cited it as a key influence. Calling it garbage is goofy especially when it's gotta a higher critic score than most Netflix movies 78% vs 58%.,,kfquy7j,kfqq455,1,2023-12-31 20:41:45,https://www.reddit.com/r/netflix/comments/18v14ot/the_real_reason_it_often_feels_like_theres/kfquy7j
"> Netflix has consistently been accused of grooming

Hardly. There’s been a vocal minority but it’s been far from *consistent*.

> which really goes to show how bad it really is 

Howso?

>  critics absolutely hated that so much they had to cancel it after one season on s cliffhanger

It was cancelled due to a lack of viewership. Plenty of Netflix shows have had a less-than-stellar critical reception yet still been a success overall.",,kfovzj5,kfom192,3,2023-12-31 12:30:58,https://www.reddit.com/r/netflix/comments/18v14ot/the_real_reason_it_often_feels_like_theres/kfovzj5
"I know I was comparing the two there's a difference between some of the most critically acclaimed shows of all time(sopranos, the wire, got) and shows that are constantly accused of grooming like Netflix is. Which is why most people don't watch a lot of the stuff Netflix puts out since there's so much of it and it's not great.",,kfpa3xt,kfon38b,0,2023-12-31 14:40:22,https://www.reddit.com/r/netflix/comments/18v14ot/the_real_reason_it_often_feels_like_theres/kfpa3xt
[deleted],,kfoh391,kfogyxc,2,2023-12-31 09:23:00,https://www.reddit.com/r/netflix/comments/18v14ot/the_real_reason_it_often_feels_like_theres/kfoh391
[deleted],,kfqyzbb,kfquy7j,1,2023-12-31 21:05:43,https://www.reddit.com/r/netflix/comments/18v14ot/the_real_reason_it_often_feels_like_theres/kfqyzbb
"Dude, you are a little too invested in defending a mediocre streaming service.",,kfp3yny,kfovzj5,2,2023-12-31 13:49:44,https://www.reddit.com/r/netflix/comments/18v14ot/the_real_reason_it_often_feels_like_theres/kfp3yny
""" was cancelled due to a lack of viewership."" Yes oftentimes Netflix shows are so bad critics hate them and no one is watching which is why they cancel them after 2 years. Bro cuties got massive amounts of hate from all around the world for grooming and Netflix is consistently accused of this, watchdogs have pointed this out it's not just some fringe groups online, I know company loyalty is a powerful thing but there's something objectively wrong with a movie like cuties",,kfpb5ff,kfovzj5,0,2023-12-31 14:48:22,https://www.reddit.com/r/netflix/comments/18v14ot/the_real_reason_it_often_feels_like_theres/kfpb5ff
That's not really relevant to what you replied to.,,kfpck18,kfpa3xt,3,2023-12-31 14:58:50,https://www.reddit.com/r/netflix/comments/18v14ot/the_real_reason_it_often_feels_like_theres/kfpck18
"Yes and they're succeeding because of brand loyalty and first mover advantage except none of their franchises have come anywhere close to the success of many of these other companies Winnie the Pooh has grossed billions, Mickey Mouse has made Disney billions and we've already admitted they're not as critically applauded as HBO they're worse in almost every regard.",,kfohl4e,kfoh391,2,2023-12-31 09:29:24,https://www.reddit.com/r/netflix/comments/18v14ot/the_real_reason_it_often_feels_like_theres/kfohl4e
I was reiterating my point which is Netflix doesn't really have much content worth watching. I'm agreeing with you Netflix is terrible.,,kfr0urt,kfqyzbb,2,2023-12-31 21:17:01,https://www.reddit.com/r/netflix/comments/18v14ot/the_real_reason_it_often_feels_like_theres/kfr0urt
Howso? Genuine question.,,kfp4t17,kfp3yny,1,2023-12-31 13:57:05,https://www.reddit.com/r/netflix/comments/18v14ot/the_real_reason_it_often_feels_like_theres/kfp4t17
Except it absolutely is.,,kfpcoyj,kfpck18,0,2023-12-31 14:59:51,https://www.reddit.com/r/netflix/comments/18v14ot/the_real_reason_it_often_feels_like_theres/kfpcoyj
"The HBO we once knew is loooong gone. Other than The Last of Us, which isn't even their original story, what was their last great hit?",,kfots20,kfohl4e,2,2023-12-31 12:05:32,https://www.reddit.com/r/netflix/comments/18v14ot/the_real_reason_it_often_feels_like_theres/kfots20
"My apologies, I conflated this thread and your thoughtful analysis with another Netflix thread where the OP has the intellect of a turnip.  You are correct and I withdraw my comment.  Let us rejoice that reasonable people can finally say publicly: Netflix is a subpar product.",,kfr1x9e,kfr0urt,1,2023-12-31 21:23:41,https://www.reddit.com/r/netflix/comments/18v14ot/the_real_reason_it_often_feels_like_theres/kfr1x9e
"Quoting a replying in defense of Netflix?  Defending them from the grooming allegations.  

There is your good faith answer.",,kfp6rvs,kfp4t17,-1,2023-12-31 14:13:50,https://www.reddit.com/r/netflix/comments/18v14ot/the_real_reason_it_often_feels_like_theres/kfp6rvs
I believe you think that.,,kfpcs7d,kfpcoyj,2,2023-12-31 15:00:32,https://www.reddit.com/r/netflix/comments/18v14ot/the_real_reason_it_often_feels_like_theres/kfpcs7d
Chernobyl.and House of the Dragon also true detective has a new season coming out in spring,,kfpbmby,kfots20,2,2023-12-31 14:51:52,https://www.reddit.com/r/netflix/comments/18v14ot/the_real_reason_it_often_feels_like_theres/kfpbmby
Just because you don't understand how something is relevant doesn't make it any less relevant,,kfpcvjy,kfpcs7d,1,2023-12-31 15:01:14,https://www.reddit.com/r/netflix/comments/18v14ot/the_real_reason_it_often_feels_like_theres/kfpcvjy
"I stopped watching netflix months ago and i do not pay for it. When i want to watch on my TV it will ask to renew the sub but when i go to my phone app it will ask the same and i just click on "" not now "" and i have access. When i start casting to my TV i bypass the prompt given before on the TV and i can use it. Might be a bug idk maybe someone has the same ""issue""  im taking advantage of it and watch naruto. 

i share my acc with my mom but only her and its my acc and she watches regurarly netflix and i always wondered why she could watch without me paying then i started to try myself and here i am",not paying but still watching,14u210h,0,13,2023-07-08 12:45:09,https://www.reddit.com/r/netflix/comments/14u210h/not_paying_but_still_watching/
Same here. I can see why maybe they are allowing it because a lot of people do watch on their phone and it won’t be on home network.,,jr5ftfd,14u210h,5,2023-07-08 14:32:28,https://www.reddit.com/r/netflix/comments/14u210h/not_paying_but_still_watching/jr5ftfd
"Maybe it’s a quarterly reporting thing. Not paying, but still including in the subscriber counts.",,jr6f9qf,14u210h,2,2023-07-08 18:56:39,https://www.reddit.com/r/netflix/comments/14u210h/not_paying_but_still_watching/jr6f9qf
![gif](giphy|x4kwwbqmmi6jnDC60a|downsized),,jr568c1,14u210h,-22,2023-07-08 13:00:28,https://www.reddit.com/r/netflix/comments/14u210h/not_paying_but_still_watching/jr568c1
So you're a theif. Congratulations. Thank you for sharing.,,jr9a5f6,14u210h,-7,2023-07-09 10:17:19,https://www.reddit.com/r/netflix/comments/14u210h/not_paying_but_still_watching/jr9a5f6
Netflix stock is UP,,jr84doz,14u210h,1,2023-07-09 02:38:28,https://www.reddit.com/r/netflix/comments/14u210h/not_paying_but_still_watching/jr84doz
W thief L corporate shill,,jr9cgxj,jr9a5f6,2,2023-07-09 10:51:17,https://www.reddit.com/r/netflix/comments/14u210h/not_paying_but_still_watching/jr9cgxj
:c,,jr9dhg0,jr9a5f6,1,2023-07-09 11:05:36,https://www.reddit.com/r/netflix/comments/14u210h/not_paying_but_still_watching/jr9dhg0
"I have my own Netflix account that’s only logged in on my one Apple TV, and I’ve never given the password to anyone. I can’t get more than a few seconds through a show before I get an error for too many devices being used. I’ve gone through my account settings and it just shows my one device logged in. Is this a common bug or?","Netflix “in use on too many devices,” but not actually?",124e8gi,0,13,2023-03-28 06:21:48,https://www.reddit.com/r/netflix/comments/124e8gi/netflix_in_use_on_too_many_devices_but_not/
[deleted],,jdyzxec,124e8gi,8,2023-03-28 06:43:29,https://www.reddit.com/r/netflix/comments/124e8gi/netflix_in_use_on_too_many_devices_but_not/jdyzxec
"Kinda feel like something else is wrong and they defaulted to that error message. Happens sometimes with badly written software. 

https://www.reddit.com/r/netflix/comments/112qbw5/your_netflix_account_is_in_use_on_too_many_devices/

Others talked about something similar here. Some say connection issues. Someone gave a tip to ""close"" the app on Apple TV because it sometimes stays active.",,jdz6t6f,124e8gi,1,2023-03-28 08:14:36,https://www.reddit.com/r/netflix/comments/124e8gi/netflix_in_use_on_too_many_devices_but_not/jdz6t6f
I did log out all devices even though there was no other devices listed lol. It did nothing but I’ll try changing the password.,,jdz031k,jdyzxec,2,2023-03-28 06:45:24,https://www.reddit.com/r/netflix/comments/124e8gi/netflix_in_use_on_too_many_devices_but_not/jdz031k
"Get Netflix to log you out of all devices, I apparently I was still logged into my iPhone 5s which is in landfill right now",,jf1ljhf,jdz6t6f,1,2023-04-05 13:41:49,https://www.reddit.com/r/netflix/comments/124e8gi/netflix_in_use_on_too_many_devices_but_not/jf1ljhf
"Meant to cancel last month, missed the cutoff by one day. So now I've been subjected to several weeks of ""are you sure you meant to do that?"" Not only every time I open the app, but even once in a while while scrolling through the app.

I've got 10 days to go, if they're going to bug me six times a day to turn my account back on, it's just going to cement my decision!

Okay /rant",(Rant) Are you sure? Are you sure? Are you sure? They're really offended that I canceled my account!,12s33qp,0,1,2023-04-19 18:08:54,https://www.reddit.com/r/netflix/comments/12s33qp/rant_are_you_sure_are_you_sure_are_you_sure/
