content,title,commentId,parentId,upVotes,date,link
"I've only noticed it in episode 4 but now can't unhear it when it happens. It really stands out because there's a scene where people are having a conversation and all sound like they have a lisp then there's a line obviously recorded later and cut in that sounds perfect.

It's equal parts terrible and hilarious.",,jlzigjq,12banod,1,2023-05-28 21:19:00,https://www.reddit.com/r/netflix/comments/12banod/the_night_agent_audio_quality/jlzigjq
I googled ‘Netflix lisp sound’ because I’m watching The Night Agent. Incredible that this is the first result.,,jsnz9ea,12banod,1,2023-07-20 01:31:35,https://www.reddit.com/r/netflix/comments/12banod/the_night_agent_audio_quality/jsnz9ea
"Google brought me here as well. It is horrible. Worst part is that I didn't notice until I went to the cinema and came back. Once you're aware of it, it ruins the whole show. I hope they seriously fix this.",,juotgez,12banod,1,2023-08-04 00:12:06,https://www.reddit.com/r/netflix/comments/12banod/the_night_agent_audio_quality/juotgez
Googling 'night agent speech impediment' brought me here. So glad it wasn't just me going crazy noticing this!!,,jutgz49,12banod,1,2023-08-04 22:45:06,https://www.reddit.com/r/netflix/comments/12banod/the_night_agent_audio_quality/jutgz49
"Wow 
I can't believe this thread exists!
I'm an audio engineer and this was really bugging me!
I thought they had all got bad new teeth!

Really bad sound engineering!!",,juw5zod,12banod,1,2023-08-05 14:09:03,https://www.reddit.com/r/netflix/comments/12banod/the_night_agent_audio_quality/juw5zod
"I actually thought they found like 10 actors with an overbite! Hahaha

Thank you for this awesome thread and info!!!",,jzaq3qw,12banod,1,2023-09-05 23:16:41,https://www.reddit.com/r/netflix/comments/12banod/the_night_agent_audio_quality/jzaq3qw
Glad I’m not alone! I’m having a hard time concentrating on the story because of the bad sound quality,,kgi1ii5,12banod,1,2024-01-05 22:34:55,https://www.reddit.com/r/netflix/comments/12banod/the_night_agent_audio_quality/kgi1ii5
"I was convinced all the actors were wearing Invisalign. Love Reddit for both making feel less crazy, but also more at the same time.",,kp99kvb,12banod,1,2024-02-07 00:00:30,https://www.reddit.com/r/netflix/comments/12banod/the_night_agent_audio_quality/kp99kvb
Mouth guards! Perfect description. I was thinking it sounded like they were all talking with a clenched jaw or something.,,jhvh2zt,jhi80ky,3,2023-04-27 04:07:17,https://www.reddit.com/r/netflix/comments/12banod/the_night_agent_audio_quality/jhvh2zt
Yes! I didn’t think of mouth guard but found this thread searching “retainer”,,jrw6czn,jhi80ky,1,2023-07-14 05:06:25,https://www.reddit.com/r/netflix/comments/12banod/the_night_agent_audio_quality/jrw6czn
So interesting. They must have turned it up so far they broke the knob,,jf9wc9o,jf8d6n2,2,2023-04-07 04:24:06,https://www.reddit.com/r/netflix/comments/12banod/the_night_agent_audio_quality/jf9wc9o
"It's only certain characters though... maybe a bad boom or lav mic? The scene I'm watching now has Maddie and her father, and she shounds shilly like Sean Connery, but he sounds just fine. I'm guessing they're doing all their filming with the same crew, and some of the equipmunk isn't up to snuff.",,jg1pzcw,jf8d6n2,2,2023-04-13 04:01:20,https://www.reddit.com/r/netflix/comments/12banod/the_night_agent_audio_quality/jg1pzcw
+1 Sounds awful. Nobody must have watched the show before they released it. Sounds the same on my HT and my headphones.,,jf42ip4,jeymkjf,2,2023-04-05 23:29:02,https://www.reddit.com/r/netflix/comments/12banod/the_night_agent_audio_quality/jf42ip4
Same,,jrw6i31,jf4o5hc,1,2023-07-14 05:07:43,https://www.reddit.com/r/netflix/comments/12banod/the_night_agent_audio_quality/jrw6i31
"Yes I agree. Last episode is the worst with this issue. I guess the sound editors edited this last and were eager for the weekend, or to reach the deadline with no time for reviewing the result.",,juott1k,jg496he,2,2023-08-04 00:14:39,https://www.reddit.com/r/netflix/comments/12banod/the_night_agent_audio_quality/juott1k
Netflix must be just cranking these shows out. You would think they would fix the sound and replace it.,,ka99hqs,jkpa8gt,1,2023-11-22 03:57:31,https://www.reddit.com/r/netflix/comments/12banod/the_night_agent_audio_quality/ka99hqs
"Same! This really reflects bad on Netflix, and doesn't help their reputation of rushing production, releasing shows quickly and dropping them.",,juoufje,jsnz9ea,1,2023-08-04 00:19:07,https://www.reddit.com/r/netflix/comments/12banod/the_night_agent_audio_quality/juoufje
"It's about a man who was in prison for murder, I think. He's being interviewed and talking directly to the camera most of the time.


The part I remember most is that he was being transported somewhere in a police car when they stopped at a gas station. He asked to use the restroom, and somehow escape. I believe he attacked one of the cops. 


I remember he had to walk down the train tracks for many miles and his feet were all cut up and blistered. He ended up stealing a car and maybe even boarding a plane. He got pretty far and stayed out of jail for a little while. I think maybe he went to Florida?",Can anyone tell me the name of this crime documetary?,1795p3b,0,5,2023-10-16 14:14:18,https://www.reddit.com/r/netflix/comments/1795p3b/can_anyone_tell_me_the_name_of_this_crime/
Fear of 13,,k5420hp,1795p3b,4,2023-10-16 14:25:49,https://www.reddit.com/r/netflix/comments/1795p3b/can_anyone_tell_me_the_name_of_this_crime/k5420hp
Thank you so much. That was bugging the shit out of me.,,k542pi0,k5420hp,3,2023-10-16 14:31:05,https://www.reddit.com/r/netflix/comments/1795p3b/can_anyone_tell_me_the_name_of_this_crime/k542pi0
"I checked and there are no restrictions on my account (I was watching the movie about two hours ago) Same thing is happening on my phone when connected to wifi, what is causing this?

https://reddit.com/link/176lt7z/video/kizb0nec5vtb1/player

&#x200B;",Movies/shows not showing up on my profile specifically?,176lt7z,0,23,2023-10-13 01:20:53,https://www.reddit.com/r/netflix/comments/176lt7z/moviesshows_not_showing_up_on_my_profile/
"I'm having the same problem, the show I was watching isn't showing on my profile but it is in other profiles on the account",,k4ndbni,176lt7z,6,2023-10-13 02:51:09,https://www.reddit.com/r/netflix/comments/176lt7z/moviesshows_not_showing_up_on_my_profile/k4ndbni
Having the same issue…,,k4n574z,176lt7z,4,2023-10-13 01:56:17,https://www.reddit.com/r/netflix/comments/176lt7z/moviesshows_not_showing_up_on_my_profile/k4n574z
"Having the same issue, tried contacting Netflix and they said it was a WiFi issue. But my boyfriends profile still show ALL the shows/movies. Doesn’t make sense",,k4ndhof,176lt7z,4,2023-10-13 02:52:18,https://www.reddit.com/r/netflix/comments/176lt7z/moviesshows_not_showing_up_on_my_profile/k4ndhof
this is happening to me too it shows up on all profiles except mine,,k722a0u,176lt7z,2,2023-10-30 06:11:56,https://www.reddit.com/r/netflix/comments/176lt7z/moviesshows_not_showing_up_on_my_profile/k722a0u
"I’m having this same issue and it‘s so frustrating. I spent 2 hours with Netflix support tonight without any resolution or even an idea of what may be causing the issue. The show I want to watch shows up on all three other profile in my account as well as on my profile when I’m not on Wi-Fi. Doesn’t make much sense. I don’t really understand how it could possibly be an ISP issue when it only affects a single profile but who knows. I did already do a reset of my router. If anyone figures it out I cant wait to hear the resolution!

Update: It seemed to spontaneously resolve. No clue what happened, but I’m glad it’s fixed.",,k7qiw8z,176lt7z,2,2023-11-04 01:57:32,https://www.reddit.com/r/netflix/comments/176lt7z/moviesshows_not_showing_up_on_my_profile/k7qiw8z
"Same issue here. Customer support told me they're aware of the issue but no timeline when it will get fixed. Just told me to watch from another profile.

Is everyone having this issue on their main profile?",,k7ravgd,176lt7z,1,2023-11-04 06:27:44,https://www.reddit.com/r/netflix/comments/176lt7z/moviesshows_not_showing_up_on_my_profile/k7ravgd
"Having the same issue, let me know if you resolved it!",,k9itv43,176lt7z,1,2023-11-16 17:00:50,https://www.reddit.com/r/netflix/comments/176lt7z/moviesshows_not_showing_up_on_my_profile/k9itv43
"Exact same issue with me rn with Shameless. Only the trailer showed up on my profile. I watched it when I had my VPN on cause I had no service where I was at, turned my VPN on when I got home and finished the episode and then after that episode kept getting error messages, then I refreshed the page and now only the trailer is showing up again. 
I thought maybe someone had restricted it on my profile cause it’s my family’s account but no one said anything to me so idk. It shows up on another profiles tho. Super irritating",,k9tgn78,176lt7z,1,2023-11-18 22:32:58,https://www.reddit.com/r/netflix/comments/176lt7z/moviesshows_not_showing_up_on_my_profile/k9tgn78
Having this issue with suits. Any resolution? Netflix support keeps trying to tell me it’s an ISP issue but it shows up on other profiles and on mine when using VPN.,,kaql05j,176lt7z,1,2023-11-25 19:59:34,https://www.reddit.com/r/netflix/comments/176lt7z/moviesshows_not_showing_up_on_my_profile/kaql05j
"I am having this problem right now and getting the same responses from Netflix support that everyone else is too. Their support is absolutely fucking terrible. I have things appearing in one profile but not another and it’s making me insane.

When you say you reset your router, you mean you left it unplugged over night?",,kfwj0t4,176lt7z,1,2024-01-01 23:48:48,https://www.reddit.com/r/netflix/comments/176lt7z/moviesshows_not_showing_up_on_my_profile/kfwj0t4
"If this problem arises for you guys, ask your ISP providers to walk you through the process of changing from dynamic IP to PPOE.( if you guys have a ""ISP login and password"" enter that under PPOE section after logging into your router). or tell them to do that above process for you guys.",,kfzpau0,176lt7z,1,2024-01-02 16:11:47,https://www.reddit.com/r/netflix/comments/176lt7z/moviesshows_not_showing_up_on_my_profile/kfzpau0
I got the same issue. Hope there's a fix for this,,kh4mcn9,176lt7z,1,2024-01-09 23:27:19,https://www.reddit.com/r/netflix/comments/176lt7z/moviesshows_not_showing_up_on_my_profile/kh4mcn9
"3 months later, same issue is happening with me!! Now I have to watch greys anatomy AND young Sheldon on my brothers profile...",,khxt15z,176lt7z,1,2024-01-15 07:38:34,https://www.reddit.com/r/netflix/comments/176lt7z/moviesshows_not_showing_up_on_my_profile/khxt15z
"3 months later, same issue is happening with me!! Now I have to watch greys anatomy AND young Sheldon on my brothers profile...",,khxt1fq,176lt7z,1,2024-01-15 07:38:39,https://www.reddit.com/r/netflix/comments/176lt7z/moviesshows_not_showing_up_on_my_profile/khxt1fq
Just found this post. It's happening to me on 2 profiles. It's been like this for 2 or 3 weeks. Guess I'll try unplugging the router overnight first.,,kpvs26q,176lt7z,1,2024-02-11 04:34:36,https://www.reddit.com/r/netflix/comments/176lt7z/moviesshows_not_showing_up_on_my_profile/kpvs26q
This is happening to me now too! Why is grey's showing up on other profiles on my account but not mine. I noticed that its only netflix originals that are showing up on my profile...,,kqbal1c,176lt7z,1,2024-02-14 00:10:00,https://www.reddit.com/r/netflix/comments/176lt7z/moviesshows_not_showing_up_on_my_profile/kqbal1c
I'll just hope it's a bug that resolves soon,,k4n6fa8,k4n574z,3,2023-10-13 02:04:41,https://www.reddit.com/r/netflix/comments/176lt7z/moviesshows_not_showing_up_on_my_profile/k4n6fa8
I just unplugged my router overnight and in the morning issue was gone. Although there might be a router setting for it the app for my router wasn't working so i just  unplugged it when i went to sleep.,,k74efwu,k722a0u,1,2023-10-30 18:30:11,https://www.reddit.com/r/netflix/comments/176lt7z/moviesshows_not_showing_up_on_my_profile/k74efwu
"While you think your router reset you may have not, I left. mine unplugged for about and hour and it didn't work, I unplugged it overnight and it all went away. How did you reset your router?",,k7u99s6,k7qiw8z,1,2023-11-04 21:03:49,https://www.reddit.com/r/netflix/comments/176lt7z/moviesshows_not_showing_up_on_my_profile/k7u99s6
"Not sure about the main profile but I probably am the most used profile, regardless just letting my router reset fixed it.",,k7u904p,k7ravgd,1,2023-11-04 21:02:01,https://www.reddit.com/r/netflix/comments/176lt7z/moviesshows_not_showing_up_on_my_profile/k7u904p
"I unplugged my router overnight and it was fixed in the morning, Probably a more direct way of resetting the router that's a bit easier but it works.",,k9jncjc,k9itv43,1,2023-11-16 20:01:15,https://www.reddit.com/r/netflix/comments/176lt7z/moviesshows_not_showing_up_on_my_profile/k9jncjc
"So as far as I know, the problem arises when you use a vpn, because of the vpn.  
Netflix can detect a vpn, and to get around people using a vpn to access the library of another country, they just give you the international library.

This problem goes away after a router reset for me, but it comes back if i use netflix on my laptop with a vpn.",,kb0jufo,kaql05j,1,2023-11-27 19:43:23,https://www.reddit.com/r/netflix/comments/176lt7z/moviesshows_not_showing_up_on_my_profile/kb0jufo
"If this problem arises for you guys, ask your ISP providers to walk you through the process of changing from dynamic IP to PPOE.( if you guys have a ""ISP login and password"" enter that under PPOE section after logging into your router). or tell them to do that above process for you guys.",,kfzpf5u,kfwj0t4,1,2024-01-02 16:12:33,https://www.reddit.com/r/netflix/comments/176lt7z/moviesshows_not_showing_up_on_my_profile/kfzpf5u
"So for me, it looks like I got a new IP and Netflix thought I was on VPN. Modem reset for 15 minutes and I’m back!",,k4nigyp,k4n6fa8,4,2023-10-13 03:26:43,https://www.reddit.com/r/netflix/comments/176lt7z/moviesshows_not_showing_up_on_my_profile/k4nigyp
How did you reset it? Like the Ip or did you just unplug it for 15 mins and plug it back in?,,k4si43g,k4nigyp,1,2023-10-14 03:07:26,https://www.reddit.com/r/netflix/comments/176lt7z/moviesshows_not_showing_up_on_my_profile/k4si43g
More like 40 minutes but yes! Still going strong!,,k4u1b6a,k4si43g,2,2023-10-14 13:12:32,https://www.reddit.com/r/netflix/comments/176lt7z/moviesshows_not_showing_up_on_my_profile/k4u1b6a
"I was watching S2 E10 and it was all fine until I finished that episode then I started the next one, and it was in French?? And I can’t change it back to English?? I’ve tried multiple episodes, even the one I had just watched not even 5 minutes before. I even checked other shows on my Netflix and those are all fine, I tried closing the app, but the only available audio option I have for B99 is French… Has this happened to anyone? Anyone have any idea how to fix it? I’ve watched this show basically every single night for the last 5 years to go to bed, I’ve probably watched through the whole series at least 100 times (not even over exaggerating) and nothing like this has ever happened before.",Netflix Canada Brooklyn 99,16kual7,0,38,2023-09-17 08:26:52,https://www.reddit.com/r/netflix/comments/16kual7/netflix_canada_brooklyn_99/
Yes. It’s on whole netflix canada.,,k0y8365,16kual7,4,2023-09-17 08:36:48,https://www.reddit.com/r/netflix/comments/16kual7/netflix_canada_brooklyn_99/k0y8365
"trying contacting their customer service, maybe they'll help",,k0y8qyu,16kual7,4,2023-09-17 08:44:32,https://www.reddit.com/r/netflix/comments/16kual7/netflix_canada_brooklyn_99/k0y8qyu
It happened to me as well. I think it’s a bug.,,k0y975r,16kual7,2,2023-09-17 08:49:37,https://www.reddit.com/r/netflix/comments/16kual7/netflix_canada_brooklyn_99/k0y975r
"I was freaking out, thank goodness it's not just me",,k0yf7bb,16kual7,1,2023-09-17 09:56:58,https://www.reddit.com/r/netflix/comments/16kual7/netflix_canada_brooklyn_99/k0yf7bb
Contacted customer service they are aware of the bug they said to just keep refreshing netflix every once in a while eventually it will be fixed,,k0yljro,16kual7,1,2023-09-17 11:11:45,https://www.reddit.com/r/netflix/comments/16kual7/netflix_canada_brooklyn_99/k0yljro
I tested it with a few shows and they’re all in French for me. No odd account activity and all language settings say English.,,k0z1cs4,16kual7,1,2023-09-17 13:31:42,https://www.reddit.com/r/netflix/comments/16kual7/netflix_canada_brooklyn_99/k0z1cs4
I was so confused glad to get some clarification on this. Hopefully it’s fixed soon,,k0z3f32,16kual7,1,2023-09-17 13:46:48,https://www.reddit.com/r/netflix/comments/16kual7/netflix_canada_brooklyn_99/k0z3f32
"I called their support, they said they’re working on it and to check back later to see if it’s fixed",,k0zgkuu,16kual7,1,2023-09-17 15:14:42,https://www.reddit.com/r/netflix/comments/16kual7/netflix_canada_brooklyn_99/k0zgkuu
"Happened to me as well, my boyfriend and I turn it one every night as our background noise well we sleep. Suddenly it's in French and can't be changed back english, really hoping this is a mistake.",,k0ztmk5,16kual7,1,2023-09-17 16:33:07,https://www.reddit.com/r/netflix/comments/16kual7/netflix_canada_brooklyn_99/k0ztmk5
"Glad it’s not just me, woke up turned b99 on and thought I was glitching because I couldn’t understand it",,k0zun6w,16kual7,1,2023-09-17 16:39:23,https://www.reddit.com/r/netflix/comments/16kual7/netflix_canada_brooklyn_99/k0zun6w
"It’s happening to me too, but when I try other shows/movies. They’re fine",,k101b6i,16kual7,1,2023-09-17 17:20:31,https://www.reddit.com/r/netflix/comments/16kual7/netflix_canada_brooklyn_99/k101b6i
"Hello, my daughters just started watching the show and they loved it, today it's not working :(, I hope it's just a glitch and not getting removed, we'll try to find a way to report this to Netflix so they can look into this.",,k1025pd,16kual7,1,2023-09-17 17:25:37,https://www.reddit.com/r/netflix/comments/16kual7/netflix_canada_brooklyn_99/k1025pd
"Update on my previous comment, this is from Netflix: ""We are really sorry for the trouble caused to you. Netflix is aware of this issue and we are currently reviewing this .Do not go through the hassle of contacting us back as we have taken a note of this issue. Our team is actively working on a fix and once it is resolved, you will be back to streaming automatically. We appreciate your patience on this to let us investigate further. Thank you for reporting this to us"".",,k102uz8,16kual7,1,2023-09-17 17:29:59,https://www.reddit.com/r/netflix/comments/16kual7/netflix_canada_brooklyn_99/k102uz8
It’s back!,,k103xww,16kual7,1,2023-09-17 17:36:39,https://www.reddit.com/r/netflix/comments/16kual7/netflix_canada_brooklyn_99/k103xww
"Wtffff I hope it’s just a glitch of some sort, I’m going to be so sad if I can’t watch it anymore",,k0y86ve,k0y8365,1,2023-09-17 08:38:01,https://www.reddit.com/r/netflix/comments/16kual7/netflix_canada_brooklyn_99/k0y86ve
"Yeah if it’s still like that in the morning I’m going to, it’s very late right now so I’m going to bed haha",,k0y8tty,k0y8qyu,1,2023-09-17 08:45:28,https://www.reddit.com/r/netflix/comments/16kual7/netflix_canada_brooklyn_99/k0y8tty
omg same i love brooklyn 99 i was so confused on what’s going on i even deleted my account in netflix and made a new one but nothing fixed,,k0zgg9h,k0yf7bb,1,2023-09-17 15:14:00,https://www.reddit.com/r/netflix/comments/16kual7/netflix_canada_brooklyn_99/k0zgg9h
Same here ! Most shows will start in French but I can change it back to English (even though all my account settings say English). B99 seems like the only one that won’t give me the option to switch to English. And season 1 is MIA.,,k0zlf7k,k0z1cs4,1,2023-09-17 15:42:59,https://www.reddit.com/r/netflix/comments/16kual7/netflix_canada_brooklyn_99/k0zlf7k
"I chatted in last night when French Jake, who talks about twice as loud as Andy woke me up. It's a known issue they are looking into. Aka: Some intern accidentally erased the audio files except for French.",,k102p1m,k0y8tty,3,2023-09-17 17:28:57,https://www.reddit.com/r/netflix/comments/16kual7/netflix_canada_brooklyn_99/k102p1m
"There was a show I watched years ago on Netflix, that I can't seem to find throughout all my searching. The show is a childrens show, with cartoon animals that are sort of cylindrical shaped, and they do not speak a word. They never speak, and they are cartoons just running around a real world house and getting into trouble. And also fighting with each other sometimes. I can only remember 1 character with a lot of detail, which was a golden dog who wore a lot of pink. She was prissy, and the best way I can describe her looks is like Isabelle from Animal crossing new horizons, but like not. It's just really bugging me that I can't remember it and I really want to watch it again. I'll continue my search of trying to find it, but I would appreciate some help!!",I need help looking for a show.,13fa7aq,0,9,2023-05-12 05:05:32,https://www.reddit.com/r/netflix/comments/13fa7aq/i_need_help_looking_for_a_show/
Cowboy Bepop (1998 animated series),,jjva5jl,13fa7aq,2,2023-05-12 14:03:54,https://www.reddit.com/r/netflix/comments/13fa7aq/i_need_help_looking_for_a_show/jjva5jl
Breaking bad,,jjwfy11,13fa7aq,-1,2023-05-12 18:53:39,https://www.reddit.com/r/netflix/comments/13fa7aq/i_need_help_looking_for_a_show/jjwfy11
"Let me know if you find it, I used to crush on the characters lmao",,jju67ve,13fa7aq,1,2023-05-12 06:15:47,https://www.reddit.com/r/netflix/comments/13fa7aq/i_need_help_looking_for_a_show/jju67ve
"I think it's ""3-2-1 Penguins!"" Which was available on Netflix years ago",,jjuese6,13fa7aq,1,2023-05-12 08:02:10,https://www.reddit.com/r/netflix/comments/13fa7aq/i_need_help_looking_for_a_show/jjuese6
If you don’t get the answers here r/tipofmytongue is a great subreddit full of people looking to answer questions like this,,jjvhpd1,13fa7aq,1,2023-05-12 15:01:20,https://www.reddit.com/r/netflix/comments/13fa7aq/i_need_help_looking_for_a_show/jjvhpd1
"I'm only on part 2 episode 4.  I'm liking the characters and story so far but I have a couple minor nitpicks

First, lacasa de papel is a much cooler name than money heist, why did they have to change it?  I guess house of paper was too close to house of cards so they didn't want any confusion.  But money heist is still a dumb name.

Second, the close up shots of guns.  Not sure if it's because as an American I'm more familiar with weapons than European audiences but it bugs me a little when they show close up shots of guns and they are very clearly using blanks.  I get that incompetent and reckless prop masters have cost human lives on set in the past and the safety of everyone working on set but there has to be a better way.  It ruined the immersion for me to see a belt fed machine gun obviously firing blanks and a revolver loaded with dummy rounds that have a dent in the primer from when they were previously fired and the actors are pretending they're live.  If they can't get realistic looking fake bullets or handle live ammo in a safe manner they don't need the close ups that make it so obvious they're using blanks and fakea.",Watching Money Heist now,167bbwl,0,1,2023-09-01 17:09:35,https://www.reddit.com/r/netflix/comments/167bbwl/watching_money_heist_now/
money heist is bestest series,,jyq0t51,167bbwl,2,2023-09-01 22:13:23,https://www.reddit.com/r/netflix/comments/167bbwl/watching_money_heist_now/jyq0t51
So late.. I watched as soon as it released,,jyozcuw,167bbwl,1,2023-09-01 18:21:46,https://www.reddit.com/r/netflix/comments/167bbwl/watching_money_heist_now/jyozcuw
They were concerned that “House of Paper” was too similar to another show “House of Cards.” They should have kept the title in Spanish.,,jypby63,167bbwl,1,2023-09-01 19:39:14,https://www.reddit.com/r/netflix/comments/167bbwl/watching_money_heist_now/jypby63
"The names are so different that I had no idea Money Heist was La Casa de Papel. People would tell me I *had to* watch this amazing show called Money Heist (this was after it gained wider popularity with non-Spanish speaking audiences) and I was like what, never heard of it. Then I found out it was LCDP.",,jypojfr,167bbwl,1,2023-09-01 20:56:29,https://www.reddit.com/r/netflix/comments/167bbwl/watching_money_heist_now/jypojfr
"""What is the meaning of La Casa de Papel?""  


""Paper house  
“La casa de papel” means, literally, “Paper house”. But “paper” stands here for “paper money” = bills. Hence, it's the house where the paper money is printed and stored - the Mint.""  


Considering that above and that a heist by definition accurately describe the level of crime, it's not a simple burglary, then I think ""Money Heist"" works well enough :)  


The guns/ammunition did not even register for me and I suspect there are a lot of Americans etc.. who also aren't familiar enough to clock onto that.    


It's a fantastic series though so enjoy!  Tips for others who are late to this as well, you HAVE to watch it in Spanish with subtitles.  There is a world of difference between hearing the original voices versus dubbed (which imo detracts from the great cast this show has)",,jyyxoia,167bbwl,1,2023-09-03 17:57:20,https://www.reddit.com/r/netflix/comments/167bbwl/watching_money_heist_now/jyyxoia
