content,title,commentId,parentId,upVotes,date,link
"I feel like everyone loves these types of shows (Love on the Spectrum, this new one about Down syndrome) but do they rub anyone else the wrong way? I can’t quite put my finger on what it is but they all feel very inauthentic and just waaaaaay too wholesome. Yes, not all shows have to have seedy aspects to them, but the families profiled never talk about any real life issues, everyone is just so happy and shiny and sure that their child is ready for long term relationships. Maybe someone else can express it better.",Down for Love bugs me,15p9jx2,0,39,2023-08-12 17:55:16,https://www.reddit.com/r/netflix/comments/15p9jx2/down_for_love_bugs_me/
"My ex-sister-in-law was Down syndrome. Janelle was exactly like these young people. She was always positive and full of love, exactly like these young people are. They are authentic.

Personally, I’m ok with not hearing the back story from the parents. They don’t need to explain their life issues with a Down syndrome child to anyone. 
They just want their child to have the best life they can.",,jvw4fta,15p9jx2,44,2023-08-12 18:02:39,https://www.reddit.com/r/netflix/comments/15p9jx2/down_for_love_bugs_me/jvw4fta
"I'm only on episode one, but it's awesome their families are so supportive. This isn't about the parents or grandparents, it's nice they just want their kids to be happy.",,jvxq4dc,15p9jx2,25,2023-08-13 00:31:29,https://www.reddit.com/r/netflix/comments/15p9jx2/down_for_love_bugs_me/jvxq4dc
"Why would you think that just because they have down syndrome that their life is full of issues? Even if you do not think that why would there not be a show showing the good side of something that is generally seen as negative? 

The people that went on dates themselves wanted the long term relationship so really it has nothing to do with whether the family thinks they are ready or not, they are their own people and should be able to make mistakes and take a chance like the rest of us.",,jw9mpk1,15p9jx2,19,2023-08-15 11:40:34,https://www.reddit.com/r/netflix/comments/15p9jx2/down_for_love_bugs_me/jw9mpk1
"My brother-in-law has Down syndrome and my husband and I love the show. Ever since I met my husband’s family, his brother has been just another part of the family. They’ve never treated him differently or spent time complaining about how hard he makes life. I think it’s a bit rude to assume that the wholesomeness, supportiveness and love isn’t genuine. 

Sure my BIL has caused some issues with his special needs and he’s different than other people, but we love the shit out of him and his entire family including my husband have always just loved him for who he is. And I can confirm we would absolutely love for him to find a partner. He is very kind, goofy, generous and loving and deserves nothing but the best. He is also insanely positive. That tends to be in the nature of people with DS. It’s not manufactured.",,jwj16pj,15p9jx2,10,2023-08-17 04:20:25,https://www.reddit.com/r/netflix/comments/15p9jx2/down_for_love_bugs_me/jwj16pj
It's not really about the parents or has anything to do with them really. My issue is a lot if this stuff can come off as inspiration porn for ableds,,jw113wt,15p9jx2,8,2023-08-13 18:37:14,https://www.reddit.com/r/netflix/comments/15p9jx2/down_for_love_bugs_me/jw113wt
"i’m sorry but what? all the families are ever expected to say is how hard it is, how difficult it is and complain complain complain. what’s wrong with being positive for ur child’s future? maybe think why you except these families to not be happy",,jwt5o3c,15p9jx2,7,2023-08-19 03:34:23,https://www.reddit.com/r/netflix/comments/15p9jx2/down_for_love_bugs_me/jwt5o3c
Carlos wanted that @ss so bad it was hard to watch lmfaooo. Carlos was cringy for me though bc he was just ON IT man. I think someone should have explained the difference between lust and love to him and explained you have to get to know someone too by asking questions lol,,jy5hl64,15p9jx2,8,2023-08-28 23:27:18,https://www.reddit.com/r/netflix/comments/15p9jx2/down_for_love_bugs_me/jy5hl64
All I know is that Carlos is being failed by his parents in the realities of love. Super cringe when all he can ever do is hyper compliment and not get to know the person to fulfill his delusion of relationships.,,jxc47z2,15p9jx2,5,2023-08-22 23:37:54,https://www.reddit.com/r/netflix/comments/15p9jx2/down_for_love_bugs_me/jxc47z2
The positivity and confidence is beautiful to watch!,,jwmagon,15p9jx2,4,2023-08-17 20:26:37,https://www.reddit.com/r/netflix/comments/15p9jx2/down_for_love_bugs_me/jwmagon
Does anyone have any idea what Johns ring for emma is worth??,,jx5fw8z,15p9jx2,3,2023-08-21 17:32:40,https://www.reddit.com/r/netflix/comments/15p9jx2/down_for_love_bugs_me/jx5fw8z
"The one pattern I have been noticing with shows like Love on the Spectrum and Down For Love are they set them up on a blind date, and then it fails after the first and second date (for the most part). To me it feels really scripted and feels like it's all part of of an act. I understand it teaches people that not all first dates are destined to be your life-long relationship, but to do it almost every time feels predictable after a while.

Movies have taught us to build this egotistical mind where we are entitled to having a man or woman for granted, which is not how the real world works. People have to work on loving themselves first by being the best person they can be, before putting themselves out there in the dating world. These types of shows don't show it and it's teaching people that they can go out there and expect good things to come out of it, like in the movies.

Back to the show itself. I watched one episode so far, and I have some issues with the way they handled it:

1. The teacher going along with every answer Josh gave him, instead of correcting them and giving him a harsh feedback.
2. Josh's family encouraging him to drink alcohol and making himself look like a fool on the dance floor is really poor taste in judgement. Downright degrading and humiliating if you ask me. Anytime I am with my family, I would not want them to see me in a completely different context, and also make a major production if I were to interact with a random woman. When I'm with my friends, different story.
3. You can tell Josh was totally unprepared and they did not really prepare him in the dating world at all. While failure is a good thing, it can lead to improvement to fix any of the bad flaws from the previous date.

Other than that, the show is fine so far. So far, Josh is by far the funniest/quirkiest character in the show. I will watch more of them and give my review on each of the episodes later.",,jx756ar,15p9jx2,6,2023-08-21 23:54:10,https://www.reddit.com/r/netflix/comments/15p9jx2/down_for_love_bugs_me/jx756ar
I think it’s the “jaunty” music that makes it infantilizing to me.,,jwi86pb,15p9jx2,3,2023-08-17 00:50:56,https://www.reddit.com/r/netflix/comments/15p9jx2/down_for_love_bugs_me/jwi86pb
"Having worked with people with down syndrome, yes they have struggles that they deal with like anyone else, but mostly their attitude shines through and they are some of the sweetest people you will meet.  I that way, the direction of show is pretty authentic.",,jww83le,15p9jx2,3,2023-08-19 19:52:52,https://www.reddit.com/r/netflix/comments/15p9jx2/down_for_love_bugs_me/jww83le
"it bothers me too, mostly the song and editing choice. it seems infantilizing",,jw8w7kb,15p9jx2,4,2023-08-15 06:15:59,https://www.reddit.com/r/netflix/comments/15p9jx2/down_for_love_bugs_me/jw8w7kb
"shows funny idc i think its a great concept of a show, they have a jewish one so why not make it with people who have down syndrome. Its jus a show im sure they are getting paid and its scriped.",,jwhpi6d,15p9jx2,2,2023-08-16 22:45:50,https://www.reddit.com/r/netflix/comments/15p9jx2/down_for_love_bugs_me/jwhpi6d
"What could be off about packaging the personal lives of intellectually challenged people for consumption by a reality tv audience?

Regardless of how authentic what they are showing us is (in an inherently manipulative and exploitative-by-design medium like reality television), why is it ours to observe in the first place? Seriously, I saw the title card ‘Down For Love’ with a picture of some people with  down syndrome, and assumed someone was making a poor-taste joke about the already ridiculous Love on the Spectrum. When you think about how sensitive the world is today with people desperate to take offence at anything and everything it’s insane that this is given a pass. 

The only reason is because those exact people in this instance are able to tell themselves that because they think the down syndrome folks are “just so cute” it makes them a good person. They’ve dressed up patronising and exploitative voyeurism as feel-good inclusivity, and just the right people fall for it.",,k1iqb25,15p9jx2,2,2023-09-21 05:08:34,https://www.reddit.com/r/netflix/comments/15p9jx2/down_for_love_bugs_me/k1iqb25
"I’m sorry, but I’m watching it and it feels like such a joke to me. I just feel like it’s a show to poke fun. I can’t believe some of these kids parents are okay with exposing them to a tv show like this.",,jwdf0ur,15p9jx2,2,2023-08-16 02:44:30,https://www.reddit.com/r/netflix/comments/15p9jx2/down_for_love_bugs_me/jwdf0ur
Shows seems exploitative for views and content.  Also the show name is cringey,,jxd2r9h,15p9jx2,2,2023-08-23 03:48:56,https://www.reddit.com/r/netflix/comments/15p9jx2/down_for_love_bugs_me/jxd2r9h
I agree 100%. Watching it almost feels like it's extremely forced bad acting as if it's not natural at all and they just do it for tv. It feels like they get way too attached too soon like 10 minutes after they meet they are talking about wanted to get get married and how much they love each other. Obviously I would never talk down to people that have special needs and I would say the same thing if they weren't challenged but I get the same vibe you do.,,jx2ej3d,15p9jx2,1,2023-08-21 01:04:18,https://www.reddit.com/r/netflix/comments/15p9jx2/down_for_love_bugs_me/jx2ej3d
"My only criticism would be the lack of relationship coaching the participants received. If they had, people like John and Carlos may have been warned about taking things too fast. But what do I know? It appears to be working them so far. But I certainly don't need to hear the down and dirty of their lives behind the screens. It's just so nice to see people who are honest about their feelings and not afraid to show their vulnerability. And it served as the perfect brain scrub after my first-ever binge of a Real Housewives !",,k1ns8rv,15p9jx2,1,2023-09-22 03:45:50,https://www.reddit.com/r/netflix/comments/15p9jx2/down_for_love_bugs_me/k1ns8rv
I’m obsessed with Carlos. I just started watching this.,,k57b3ip,15p9jx2,1,2023-10-17 02:53:27,https://www.reddit.com/r/netflix/comments/15p9jx2/down_for_love_bugs_me/k57b3ip
"My issue is the love coach and their parents aren't encouraging them to take their time with getting into a relationship.  They are telling them they love each other on their first date and jumping into serious relationships without not understanding really what it means. 
It's really unhealthy and it's setting them up for allot if heartbreak.",,k6xgkp3,15p9jx2,1,2023-10-29 08:28:46,https://www.reddit.com/r/netflix/comments/15p9jx2/down_for_love_bugs_me/k6xgkp3
There is a show just like all these BUT they are not rich.. Thats the issue..,,kawtzkf,15p9jx2,1,2023-11-27 00:44:24,https://www.reddit.com/r/netflix/comments/15p9jx2/down_for_love_bugs_me/kawtzkf
"Some of the stars do talk about how it’s been difficult to meet someone, being bullied in school, death or parents or being given up for adoption, but no, it’s not the focus. I personally find that really refreshing. Not everything is seedy and there are a lot of people who either by nature or by choice focus on the positive and not the negative.",,kckeg79,15p9jx2,1,2023-12-08 23:26:06,https://www.reddit.com/r/netflix/comments/15p9jx2/down_for_love_bugs_me/kckeg79
That’s the absolute best thing about about people with DS- they ARE wholesome and way better than the rest of us ,,kr7dx26,15p9jx2,1,2024-02-19 22:22:19,https://www.reddit.com/r/netflix/comments/15p9jx2/down_for_love_bugs_me/kr7dx26
"The show is almost 100% high functioning adults with Down syndrome, with at least two professional actresses. So in that way it’s not a real life example of living with developmental disabilities.",,kre70c9,15p9jx2,1,2024-02-21 02:51:29,https://www.reddit.com/r/netflix/comments/15p9jx2/down_for_love_bugs_me/kre70c9
"I don't get why this guy (op) wants to hear about how negative their life is, like that must be the case for these guys.

My wife is watching this show and I keep watching little bits and leisel and Bradon for example, just to see two people so genuine and not held back like when they were just sitting opposite each other saying exactly how they felt about each other brought a tear to my eye.",,jw9mhpu,jvw4fta,23,2023-08-15 11:38:05,https://www.reddit.com/r/netflix/comments/15p9jx2/down_for_love_bugs_me/jw9mhpu
It  kinda bothers me how they are like very wealthy. Feel like it doesn't capture the true experiences of young people with DS,,jwfauxv,jw9mpk1,5,2023-08-16 13:58:30,https://www.reddit.com/r/netflix/comments/15p9jx2/down_for_love_bugs_me/jwfauxv
"Also everyone in the show is 18+, theyre adults not children",,jw119ir,jw113wt,9,2023-08-13 18:38:11,https://www.reddit.com/r/netflix/comments/15p9jx2/down_for_love_bugs_me/jw119ir
"the fact that it isnt making it about the parent's struggles or how hard it is to live with these conditions is what makes it not inspiration porn.

Inspiration porn inherently requires a level of wallowing in how hard life is before ""overcoming"" it.

The fact that they dont have love lives isnt painted as the end of the world or something super tragic and horrible, it's just presented the same way an abled person who has never dated would be.

I'm not arguing that it's moral or not exploitative in some way, but it's definitely not inspiration porn.",,jydv4ez,jw113wt,4,2023-08-30 16:15:08,https://www.reddit.com/r/netflix/comments/15p9jx2/down_for_love_bugs_me/jydv4ez
[deleted],,jwuggbm,jw113wt,1,2023-08-19 12:27:04,https://www.reddit.com/r/netflix/comments/15p9jx2/down_for_love_bugs_me/jwuggbm
"Being a bit naughty coming on here, but yes, Carlos has a lot of difficulty in understanding the difference between lust and love. And to second the other commenter yes his family are a big road block. They have this hive mentality and no one ever bothers to explain to Carlos why something may be problematic or just downright inappropriate.",,k1dgyp0,jy5hl64,4,2023-09-20 05:23:55,https://www.reddit.com/r/netflix/comments/15p9jx2/down_for_love_bugs_me/k1dgyp0
This and thats my biggest problem with the show. The participants really need healthy relationship coaching.  They are jumping into relationships and saying I love you  their first dates because they aren't  being  taught what a healthy relationship looks like.,,k6xgx9c,jy5hl64,1,2023-10-29 08:33:37,https://www.reddit.com/r/netflix/comments/15p9jx2/down_for_love_bugs_me/k6xgx9c
"Allot of these participants have been failed.
I was shocked that the one couple had no idea what sex was.",,k6xh1cn,jxc47z2,1,2023-10-29 08:35:12,https://www.reddit.com/r/netflix/comments/15p9jx2/down_for_love_bugs_me/k6xh1cn
"Disabled adults are allowed to decide if they want to drink or not, it's not up to their parents or family",,jxj94sq,jx756ar,5,2023-08-24 11:15:22,https://www.reddit.com/r/netflix/comments/15p9jx2/down_for_love_bugs_me/jxj94sq
"How is Josh making a fool of himself on the dance floor?  That’s how he expresses himself, that’s what dancing is all about. The fact that he’s uninhibited is actually refreshing.",,jxkz7fa,jx756ar,4,2023-08-24 18:49:12,https://www.reddit.com/r/netflix/comments/15p9jx2/down_for_love_bugs_me/jxkz7fa
"Agreed, it seems whist the need for love is important. A missing step is teaching personal boundaries. One man came across as creepy and you can see it obvious on the dates face.",,kqnke0i,jx756ar,1,2024-02-16 06:47:28,https://www.reddit.com/r/netflix/comments/15p9jx2/down_for_love_bugs_me/kqnke0i
"It reminds me of a lot of Netflix's ""mom"" type content. They use this in lots of baking shows; I just watched a flower competition show (with my mom!) and the soundtrack is identical. Whimsical. Happy. Young and lively. Fwiw",,jwjacvo,jwi86pb,5,2023-08-17 05:43:23,https://www.reddit.com/r/netflix/comments/15p9jx2/down_for_love_bugs_me/jwjacvo
"I remember watching some comedians with Autism on YouTube and it was a world of difference than what the Love on the Spectrum portrayed them as with the whimsical and infantilizing editing. The real life comedians were REALLY risqué, which would make sense considering they would be less inclined to have a filter. I just wish the shows had more of a variety, to show that while yeah some can be really childlike naturally…some can be really hilariously raunchy as well. The only reason I can think of for the biased editing is so that they can keep the family friendly rating to increase their viewer base? But yeah I had doubts that they all had rooms full of plushies and unicorns.",,jwaff5g,jw8w7kb,4,2023-08-15 15:29:05,https://www.reddit.com/r/netflix/comments/15p9jx2/down_for_love_bugs_me/jwaff5g
"Yes, that’s a good word for it. Glad someone can relate.

Edit..I just want to say that I don’t down vote people just because I don’t agree with what they say. It’s really funny how all the comments on this post have some up votes and mine and anyone who kind of agreed with me are down voted. You guys don’t have to down vote us just because you disagree. Reddit cracks me up.",,jw9g1u1,jw8w7kb,0,2023-08-15 10:19:25,https://www.reddit.com/r/netflix/comments/15p9jx2/down_for_love_bugs_me/jw9g1u1
"“they have a Jewish one so why not make it with people who have Down syndrome”

what?",,jwih5x8,jwhpi6d,7,2023-08-17 01:53:49,https://www.reddit.com/r/netflix/comments/15p9jx2/down_for_love_bugs_me/jwih5x8
"I don’t think it’s scripted at all. Editing can definitely give that impression on its own.

I really don’t think the people running it would be disingenuous. Look at this casting call. Not sure how accurate their claim is, but they say “Attitude Pictures is disability-led, with a strong history of providing respected and respectful disability content.”

https://m.facebook.com/NZDSA/photos/a.127499204947/10160113761284948/?type=3&locale=hi_IN

(In episode one you can see the interviewer in a wheelchair- seems like a legitimate claim to me.)",,jwirsa9,jwhpi6d,5,2023-08-17 03:08:28,https://www.reddit.com/r/netflix/comments/15p9jx2/down_for_love_bugs_me/jwirsa9
"I’m still thinking about this comment. Are you going to explain it?

And no one else posting here thought that comment was a little strange?",,jwlajra,jwhpi6d,2,2023-08-17 16:53:56,https://www.reddit.com/r/netflix/comments/15p9jx2/down_for_love_bugs_me/jwlajra
"They're adults, not kids, also disabled doesn't mean incompetent or they can't consent for themselves",,jwejyax,jwdf0ur,11,2023-08-16 09:23:07,https://www.reddit.com/r/netflix/comments/15p9jx2/down_for_love_bugs_me/jwejyax
"Why??  What about the name is cringy?  They have Down syndrome and are quite aware of that fact. They also consented to be on the show as adults.  
Exploitative for views and content?  Isn’t that the point of every show out there?",,jxkws50,jxd2r9h,5,2023-08-24 18:34:28,https://www.reddit.com/r/netflix/comments/15p9jx2/down_for_love_bugs_me/jxkws50
What real housewives did you binge? I’ve been through them all,,k1oxvdo,k1ns8rv,1,2023-09-22 11:12:58,https://www.reddit.com/r/netflix/comments/15p9jx2/down_for_love_bugs_me/k1oxvdo
yeah if I am honest that kidna bothered me too,,jwfazg3,jwfauxv,6,2023-08-16 13:59:26,https://www.reddit.com/r/netflix/comments/15p9jx2/down_for_love_bugs_me/jwfazg3
"New Zealand is totally different than the US though, their government has done a lot to heal/prevent poverty. they have more supportive social infrastructures",,jwipzpx,jwfauxv,5,2023-08-17 02:55:44,https://www.reddit.com/r/netflix/comments/15p9jx2/down_for_love_bugs_me/jwipzpx
Yea it seems like everyone comes from affluent families. It’s definitely a screwed perspective,,jwihqlm,jwfauxv,4,2023-08-17 01:57:53,https://www.reddit.com/r/netflix/comments/15p9jx2/down_for_love_bugs_me/jwihqlm
"I just said a lot of this stuff can come off as it, not that it specifically was.

I general many ableds will view it like that still anyway.",,jydvorb,jydv4ez,1,2023-08-30 16:18:38,https://www.reddit.com/r/netflix/comments/15p9jx2/down_for_love_bugs_me/jydvorb
Not inspiration porn for ableds.,,jwvb6xm,jwuggbm,1,2023-08-19 16:27:56,https://www.reddit.com/r/netflix/comments/15p9jx2/down_for_love_bugs_me/jwvb6xm
That’s good that you recognize that. Do you feel that effects your feelings for him?,,k530slb,k1dgyp0,1,2023-10-16 07:22:30,https://www.reddit.com/r/netflix/comments/15p9jx2/down_for_love_bugs_me/k530slb
Exactly. The other issue I noticed is how Josh's parents are encouraging sex. That type of stuff doesn't happen until you really get to know the person and are comfortable enough.,,jxkf8ap,jxj94sq,3,2023-08-24 16:45:55,https://www.reddit.com/r/netflix/comments/15p9jx2/down_for_love_bugs_me/jxkf8ap
[deleted],,jxhhdtr,jw9g1u1,1,2023-08-24 00:45:47,https://www.reddit.com/r/netflix/comments/15p9jx2/down_for_love_bugs_me/jxhhdtr
Subtle antisemitism essentially.,,jws9536,jwih5x8,7,2023-08-18 23:29:29,https://www.reddit.com/r/netflix/comments/15p9jx2/down_for_love_bugs_me/jws9536
"They’re referring to the other Netflix show, Jewish Matchmaking.",,jwow198,jwlajra,1,2023-08-18 08:28:43,https://www.reddit.com/r/netflix/comments/15p9jx2/down_for_love_bugs_me/jwow198
Most of the people have the mind of a child and thought they were in love before barely knowing the person.,,jwr5xdk,jwejyax,1,2023-08-18 19:18:46,https://www.reddit.com/r/netflix/comments/15p9jx2/down_for_love_bugs_me/jwr5xdk
Salt Lake City. I wanted to learn more about Jen Shah after reading about her million dollar scam operation. I'm half way through Season 2. Watching her vehemently deny her involvement was so infuriating. Total sociopath.,,k2im7px,k1oxvdo,1,2023-09-28 02:24:41,https://www.reddit.com/r/netflix/comments/15p9jx2/down_for_love_bugs_me/k2im7px
They definitely as a whole are in a different environment.,,jwma4l3,jwipzpx,5,2023-08-17 20:24:41,https://www.reddit.com/r/netflix/comments/15p9jx2/down_for_love_bugs_me/jwma4l3
NZ government makes everyone millionaires,,jx2gekv,jwipzpx,6,2023-08-21 01:18:07,https://www.reddit.com/r/netflix/comments/15p9jx2/down_for_love_bugs_me/jx2gekv
"I'm disabled myself, it affects me directly how ableds do things like that",,jydw0g8,jydvorb,1,2023-08-30 16:20:37,https://www.reddit.com/r/netflix/comments/15p9jx2/down_for_love_bugs_me/jydw0g8
What does “inspiration porn for ableds” mean,,jx2e1f0,jwvb6xm,5,2023-08-21 01:00:38,https://www.reddit.com/r/netflix/comments/15p9jx2/down_for_love_bugs_me/jx2e1f0
"Just because something is positive, it doesn’t mean it’s “inspiration porn.” Why can’t something just be a feel good show about people finding love?",,jxl5h46,jwvb6xm,5,2023-08-24 19:27:58,https://www.reddit.com/r/netflix/comments/15p9jx2/down_for_love_bugs_me/jxl5h46
"Yes it did. We're no longer together, the combined pressure of him wanting to move the relationship forward super fast along with other issues just ended up being too much in the end.",,k532zm9,k530slb,2,2023-10-16 07:50:28,https://www.reddit.com/r/netflix/comments/15p9jx2/down_for_love_bugs_me/k532zm9
"Disabled adults have sex, they are adults and can decide that for themselves",,jxkffan,jxkf8ap,3,2023-08-24 16:47:07,https://www.reddit.com/r/netflix/comments/15p9jx2/down_for_love_bugs_me/jxkffan
"I don't have an issue with Josh wanting sex. But the families need to know what the potential consequences are. What if the woman gets pregnant, what will they do? Is he ready to be a father or not? Who will help with the baby?",,khvc9va,jxkf8ap,1,2024-01-14 21:22:58,https://www.reddit.com/r/netflix/comments/15p9jx2/down_for_love_bugs_me/khvc9va
Actually they’re quite literally supposed to be used when you don’t think something contributes to the conversation. Like if someone writes something completely off topic that makes no sense. But people like to use them just as a “thumbs down” to something they don’t like.,,jxhk669,jxhhdtr,1,2023-08-24 01:05:24,https://www.reddit.com/r/netflix/comments/15p9jx2/down_for_love_bugs_me/jxhk669
"Yep that’s definitely how it sounded. I’m kind of giving the person the benefit of the doubt that they didn’t mean it that way, but it was a really unfortunate way of phrasing the sentence.",,jwt3ki9,jws9536,4,2023-08-19 03:17:18,https://www.reddit.com/r/netflix/comments/15p9jx2/down_for_love_bugs_me/jwt3ki9
Yes I know,,jwq512s,jwow198,2,2023-08-18 15:33:12,https://www.reddit.com/r/netflix/comments/15p9jx2/down_for_love_bugs_me/jwq512s
"They are adults, stop infantilising disabled folk",,jwr6x53,jwr5xdk,13,2023-08-18 19:24:56,https://www.reddit.com/r/netflix/comments/15p9jx2/down_for_love_bugs_me/jwr6x53
"Oh yeah Jen is a disgusting person. Salt Lake is fun and also insanely trashy in term of how they all look, talk, etc.",,k2jwioa,k2im7px,1,2023-09-28 09:57:34,https://www.reddit.com/r/netflix/comments/15p9jx2/down_for_love_bugs_me/k2jwioa
"I said I was hoping it wasn't.

Also it is important to be aware of if stuff is because it makes our actual lives do much worse as disabled people.",,jxlunf4,jxl5h46,1,2023-08-24 22:03:47,https://www.reddit.com/r/netflix/comments/15p9jx2/down_for_love_bugs_me/jxlunf4
