content,title,commentId,parentId,upVotes,date,link
"Have noticed this on my account as well just starting last week. One day IP addresses and locations were there, next day they were gone",,jb4k6sz,11fy20q,1,2023-03-06 11:31:23,https://www.reddit.com/r/netflix/comments/11fy20q/manage_access_and_devices/jb4k6sz
"Noticed this today as well.

It just shows: ""Amazon - Streaming Stick""  or  ""Amazon - Smart TV"" or ""Sony - Smart TV"" or ""Comcast - Set Top Box""

Etc...

If we are supposed to monitor and track our logins, to be able to log out in authorized users, Netflix is making it difficult to identify who is, and who isn't an authorized user. 

For instance I may have logged in at an AirBNB to watch my Netflix account on a ""Amazon - Streaming Stick"" but I also use a ""Amazon - Streaming Stick"" in my own home. 

How do I know know which login/device is mine, and which is the AirBNB for instance.

Anyone have any insight on how to view IP address location on Netflix Account management? The way it was by visible before in ""manage access and devices"" ?",,jc1sisy,11fy20q,1,2023-03-13 12:44:28,https://www.reddit.com/r/netflix/comments/11fy20q/manage_access_and_devices/jc1sisy
"Does anyone know if this will be fixed? Also, if someone logs in from a different time zone say cst vs est..would it show this? Or do the log in times only reflect the account owners time zone?",,jcb8ixm,11fy20q,1,2023-03-15 16:28:56,https://www.reddit.com/r/netflix/comments/11fy20q/manage_access_and_devices/jcb8ixm
Any updates how to access IP activity by device? It can't be it's just permanently removed or maybe even hidden from causal user?![gif](emote|free_emotes_pack|table_flip),,jlticu0,11fy20q,1,2023-05-27 14:17:18,https://www.reddit.com/r/netflix/comments/11fy20q/manage_access_and_devices/jlticu0
came here because netflix restarted my account without my permission. There's no way for me to know if that Fire TV that accessed my account was in my house or somewhere else. Annoying.,,jp1k94m,11fy20q,1,2023-06-22 03:21:50,https://www.reddit.com/r/netflix/comments/11fy20q/manage_access_and_devices/jp1k94m
I submitted a ticket with Netflix asking for this feature to be returned back. You think they will listen ? lol,,kfny3qj,11fy20q,1,2023-12-31 05:48:54,https://www.reddit.com/r/netflix/comments/11fy20q/manage_access_and_devices/kfny3qj
It’s ridiculous how they removed it,,kixjgso,11fy20q,1,2024-01-21 19:44:47,https://www.reddit.com/r/netflix/comments/11fy20q/manage_access_and_devices/kixjgso
"Yup possible
Let me know if you ever find one.",,k13uq8a,k13u2uj,1,2023-09-18 11:13:39,https://www.reddit.com/r/netflix/comments/11fy20q/manage_access_and_devices/k13uq8a
"i see  
Thats weird, idk but i found that thing useful.",,jalqvz5,jalpcxk,1,2023-03-02 09:36:38,https://www.reddit.com/r/netflix/comments/11fy20q/manage_access_and_devices/jalqvz5
Exactly,,jc1sqn9,jc1sisy,2,2023-03-13 12:46:28,https://www.reddit.com/r/netflix/comments/11fy20q/manage_access_and_devices/jc1sqn9
Nope i still cant see them on my account.,,jltihel,jlticu0,1,2023-05-27 14:18:29,https://www.reddit.com/r/netflix/comments/11fy20q/manage_access_and_devices/jltihel
I highly doubt about that. Haha,,kfo3sz7,kfny3qj,1,2023-12-31 06:44:55,https://www.reddit.com/r/netflix/comments/11fy20q/manage_access_and_devices/kfo3sz7
Still waiting for response lol..let me know thanks,,kgo96ly,kfny3qj,1,2024-01-07 02:14:07,https://www.reddit.com/r/netflix/comments/11fy20q/manage_access_and_devices/kgo96ly
Yess,,kizs9n6,kixjgso,2,2024-01-22 03:49:24,https://www.reddit.com/r/netflix/comments/11fy20q/manage_access_and_devices/kizs9n6
[deleted],,jalqz8z,jalqvz5,2,2023-03-02 09:37:54,https://www.reddit.com/r/netflix/comments/11fy20q/manage_access_and_devices/jalqz8z
"There must be a way to access logged in devices IP, it must be written somewhere, we must dig deeper, something fishy is going on ![gif](emote|free_emotes_pack|table_flip)",,jltj77l,jltihel,2,2023-05-27 14:24:53,https://www.reddit.com/r/netflix/comments/11fy20q/manage_access_and_devices/jltj77l
yup might be possible,,jalr55h,jalqz8z,1,2023-03-02 09:40:11,https://www.reddit.com/r/netflix/comments/11fy20q/manage_access_and_devices/jalr55h
"Yeah
Let me know if you find something.
I’ll give a try aswell.",,jltkqlw,jltj77l,1,2023-05-27 14:38:32,https://www.reddit.com/r/netflix/comments/11fy20q/manage_access_and_devices/jltkqlw
"I currently have a problem with my mobiles devices when watching netflix. The automatic subtitles, when the device is muted, turn on every time i start watching something, even tough i have my sound on. The only way i can currently turn them off is by changing the volume in either way or by deacticating them in the player settings.

This bug is only on my Pixel 7 Pro and Lenovo P11 Pro G2. The subtitles are not automatic on my PC and TV.

Can anyone help me with this problem? I could'nt find a solution anywhere.",Netflix thinks my device is muted,1alc4lc,0,3,2024-02-07 20:02:14,https://www.reddit.com/r/netflix/comments/1alc4lc/netflix_thinks_my_device_is_muted/
Anyone else having issues with casting netflix using screen sharing? I tried using my phone's screen share to cast to a TV and I could see the menu and the subtitles but the actual video wouldn't show up even though it was playing on my phone. Everything else is working fine. Is this a bug? This is getting ridiculous. I'm not even sure how they would even know I'm using my screen share since I did it through my phone and not the app.,Netflix wont let me cast from phone anymore,14cssmx,0,20,2023-06-18 20:28:19,https://www.reddit.com/r/netflix/comments/14cssmx/netflix_wont_let_me_cast_from_phone_anymore/
What a trash fvckin app. So stupid Netflix are straight greedy mfers. Billion dollar owners straight crumbs,,k71pju8,14cssmx,6,2023-10-30 03:48:06,https://www.reddit.com/r/netflix/comments/14cssmx/netflix_wont_let_me_cast_from_phone_anymore/k71pju8
"Per the website ""Using a mobile device to watch Netflix on a TV isn't available on an ad-supported plan. To use your mobile device to watch Netflix on your TV, you'll need to change to an ad-free plan.""

They removed the ability to sign in on separate networks to limit sharing, and now are removing accessibility unless you pay for their premium offering. So annoying.",,jw1rurs,14cssmx,4,2023-08-13 21:28:52,https://www.reddit.com/r/netflix/comments/14cssmx/netflix_wont_let_me_cast_from_phone_anymore/jw1rurs
"You're likely not on the same wifi as the household that signed up for the acct. If you have Chromecast, cast to that and it should work.",,joxu4vd,14cssmx,2,2023-06-21 10:04:51,https://www.reddit.com/r/netflix/comments/14cssmx/netflix_wont_let_me_cast_from_phone_anymore/joxu4vd
"""Your plan does not support streaming on this device. Go to Your Account online to change your plan."" Netflix blocked casting on the ad plan. I tried from my laptop (google browswer Chromecast) and phone (netflix app) to cast. I guess you have to manually plug in your laptop to your TV screen via HDMI to cast it directly.",,k220vrp,14cssmx,2,2023-09-24 23:09:20,https://www.reddit.com/r/netflix/comments/14cssmx/netflix_wont_let_me_cast_from_phone_anymore/k220vrp
"On my Samsung phone I am doing it by using smart view, let’s me mirror my display to my tv and then I just play Netflix on my phone",,k3yg6vt,14cssmx,2,2023-10-08 07:22:56,https://www.reddit.com/r/netflix/comments/14cssmx/netflix_wont_let_me_cast_from_phone_anymore/k3yg6vt
"I always ask this question, but never get an answer (just down votes). Why cast, and what are you casting to (Roku, firestick, TV? what does that mean).

Casting seemed to work fine casting to my Roku, but that Roku already had my signin setup. Where you on the same Wifi??",,jop9za7,14cssmx,1,2023-06-19 14:30:29,https://www.reddit.com/r/netflix/comments/14cssmx/netflix_wont_let_me_cast_from_phone_anymore/jop9za7
"Airplay and Screen Mirroring are no longer supported by Netflix. To use your phone or tablet to watch Netflix on a TV, use a supported connection.",,juiv6gk,14cssmx,1,2023-08-02 20:27:47,https://www.reddit.com/r/netflix/comments/14cssmx/netflix_wont_let_me_cast_from_phone_anymore/juiv6gk
"I have the non ad and I am not able to cast to my tv either. I was going to buy an hdmi cable but hear that doesn’t work either.

What are others doing? 

I’m apple and using Roku sticks.

I have iPhone, iPad mini, hp laptop or MacBook to use.
I’m sure there is a way, despite them shutting down the functionality.
Open to advice! :)",,k2wsjl4,14cssmx,1,2023-09-30 21:31:34,https://www.reddit.com/r/netflix/comments/14cssmx/netflix_wont_let_me_cast_from_phone_anymore/k2wsjl4
Did anyone try with apple TV?,,k346a0w,14cssmx,1,2023-10-02 09:30:50,https://www.reddit.com/r/netflix/comments/14cssmx/netflix_wont_let_me_cast_from_phone_anymore/k346a0w
"I wonder about their flawed logic - how can my phone be trusted, but not the TV...",,k87o3xl,k71pju8,3,2023-11-07 13:53:02,https://www.reddit.com/r/netflix/comments/14cssmx/netflix_wont_let_me_cast_from_phone_anymore/k87o3xl
Cheeky.. one upping the consumer once again. $$$,,k1ggcm2,jw1rurs,2,2023-09-20 20:03:45,https://www.reddit.com/r/netflix/comments/14cssmx/netflix_wont_let_me_cast_from_phone_anymore/k1ggcm2
"I have an ad-free plan and it still doesn't work! I am casting to the TV from my phone without a cable and they are on the same WIFI, but the TV isn't logged into the account.",,k87nuzr,jw1rurs,2,2023-11-07 13:51:13,https://www.reddit.com/r/netflix/comments/14cssmx/netflix_wont_let_me_cast_from_phone_anymore/k87nuzr
We are on the top paid ad-free plan and can't cast either.  There is only one network that the Chromecast and phone can be on.  It's pretty clear that Netflix is shadow banning casting.,,k7exlot,jw1rurs,1,2023-11-01 20:32:28,https://www.reddit.com/r/netflix/comments/14cssmx/netflix_wont_let_me_cast_from_phone_anymore/k7exlot
It doesn't cast on my chromecast :( i hear the audio but the screen is dark.,,jxskyml,joxu4vd,2,2023-08-26 06:10:15,https://www.reddit.com/r/netflix/comments/14cssmx/netflix_wont_let_me_cast_from_phone_anymore/jxskyml
From personal experience they are prob not in the account household and Netflix works on the phone still but not the tv so they are trying to cast to the tv. And yes casting stopped working for me as well,,jopl5rs,jop9za7,3,2023-06-19 15:55:38,https://www.reddit.com/r/netflix/comments/14cssmx/netflix_wont_let_me_cast_from_phone_anymore/jopl5rs
Such as?,,k8wb5i1,juiv6gk,2,2023-11-12 06:12:07,https://www.reddit.com/r/netflix/comments/14cssmx/netflix_wont_let_me_cast_from_phone_anymore/k8wb5i1
"Hey, did you figure anything out?",,k7bc60d,k2wsjl4,1,2023-11-01 02:09:56,https://www.reddit.com/r/netflix/comments/14cssmx/netflix_wont_let_me_cast_from_phone_anymore/k7bc60d
"if you have an appleTV, just install the app! Netflix does not support screensharing",,k62hvqi,k346a0w,1,2023-10-23 06:23:15,https://www.reddit.com/r/netflix/comments/14cssmx/netflix_wont_let_me_cast_from_phone_anymore/k62hvqi
"You have to use physical connection. Like I can watch netflix on my ipad, but what if I'm traveling and want to cast it to the hotel tv, doesn't work. But if you plug in a usb-c to hdmi, then you can watch netflix from you iPad.  


Ultimately, Netflix tis rash for all of this nonsense.",,kjvh28r,k8wb5i1,1,2024-01-27 23:23:22,https://www.reddit.com/r/netflix/comments/14cssmx/netflix_wont_let_me_cast_from_phone_anymore/kjvh28r
"Hey, I did. An hdmi cable from my computer to the tv worked just fine!",,k7bo5hp,k7bc60d,1,2023-11-01 03:51:13,https://www.reddit.com/r/netflix/comments/14cssmx/netflix_wont_let_me_cast_from_phone_anymore/k7bo5hp
I used my hp,,k7bo6q6,k7bo5hp,1,2023-11-01 03:51:32,https://www.reddit.com/r/netflix/comments/14cssmx/netflix_wont_let_me_cast_from_phone_anymore/k7bo6q6
"Is this normal or everyone with the premium package got ads on mobile ? I just ask because it's maybe a bug, but when i launch my app i got this :

&#x200B;

[My app when i launch Netflix](https://preview.redd.it/8cip21mdompb1.png?width=369&format=png&auto=webp&s=04e68b54f76b14f5e22c1a698636007a2ae3c431)

What is this exactly ? Is this a Netflix content or it will lead us to play a game with many microtransaction ? Why i got this suggestion in top of my field ? How to disable this ?","I got the best Netflix package, but Netflix send ads on my mobile phone.",16oj22z,0,1,2023-09-21 16:36:19,https://www.reddit.com/r/netflix/comments/16oj22z/i_got_the_best_netflix_package_but_netflix_send/
LOL those are just Netflix games showing in a Games row.,,k1kv68s,16oj22z,10,2023-09-21 16:52:54,https://www.reddit.com/r/netflix/comments/16oj22z/i_got_the_best_netflix_package_but_netflix_send/k1kv68s
They’re not ads. Netflix has video games but they’re only available on the mobile app.,,k1l5dtz,16oj22z,3,2023-09-21 17:52:08,https://www.reddit.com/r/netflix/comments/16oj22z/i_got_the_best_netflix_package_but_netflix_send/k1l5dtz
They are games you can play for free on your mobile device if you want to.,,k1l0dmt,16oj22z,3,2023-09-21 17:22:48,https://www.reddit.com/r/netflix/comments/16oj22z/i_got_the_best_netflix_package_but_netflix_send/k1l0dmt
"Don't see any ads here, just Netflix games. Next!",,k1mra4g,16oj22z,2,2023-09-21 23:33:17,https://www.reddit.com/r/netflix/comments/16oj22z/i_got_the_best_netflix_package_but_netflix_send/k1mra4g
"Right.  They are call ""promos"" or promotions.  Even if they don't have paid advertisements, all of the streaming services will figure out a way to promote their own content.  Max is worse.  They will throw in a promo trailer for some HBO show when you are starting a new show or a new episode.  You can skip it but it's still a pain in the ass.",,k1l5nah,k1kv68s,-3,2023-09-21 17:53:39,https://www.reddit.com/r/netflix/comments/16oj22z/i_got_the_best_netflix_package_but_netflix_send/k1l5nah
It's not promotions. It's *actual games*. It's not ads.,,k1o4dn9,k1l5nah,4,2023-09-22 05:25:28,https://www.reddit.com/r/netflix/comments/16oj22z/i_got_the_best_netflix_package_but_netflix_send/k1o4dn9
"It's a row of games, just like every other row is a row of movies and TV shows. Lmao",,k1l9d3j,k1l5nah,4,2023-09-21 18:16:54,https://www.reddit.com/r/netflix/comments/16oj22z/i_got_the_best_netflix_package_but_netflix_send/k1l9d3j
"Paramount+ is the worst for this. With Max there's a button to skip it so it's a mild inconvenience. I generally skip the into so I'd need to interact with the UI to skip something anyway. But Paramount+ doesn't let you skip it. Which is much worse. I'm pretty sure they reused the code they used to display regular ads and not being able to skip the promo is a result of that. What I'm not sure of is if that was like intentional, or just laziness.",,k1oc0ne,k1l5nah,2,2023-09-22 06:42:40,https://www.reddit.com/r/netflix/comments/16oj22z/i_got_the_best_netflix_package_but_netflix_send/k1oc0ne
"Promo for games.  Some people don't even know that Netflix has games. I didn't know for a long time.  Yes, you can click on them to play the games but few would do it unless there was a pop-up there promoting the games.",,k1r0g4m,k1o4dn9,1,2023-09-22 19:42:51,https://www.reddit.com/r/netflix/comments/16oj22z/i_got_the_best_netflix_package_but_netflix_send/k1r0g4m
"You're right, that is the worst.  Forced promos are just as bad as forced ads.",,k1r3vbc,k1oc0ne,1,2023-09-22 20:02:56,https://www.reddit.com/r/netflix/comments/16oj22z/i_got_the_best_netflix_package_but_netflix_send/k1r3vbc
I can’t remember it and im trying to watch it. Its been promoted on YouTube ads heavily but I haven’t seen it and forgot the name.  Please help its really bugging me that i can’t remember it was recently released too pretty sure it was a movie .,Whats that new Netflix program that starts of with” sometimes i dont want to wake up as someones (I think it was wife or mother) in the first few seconds of the trailer?,198fuun,0,2,2024-01-16 22:22:53,https://www.reddit.com/r/netflix/comments/198fuun/whats_that_new_netflix_program_that_starts_of/
Scarlett Johansson and Adam Driver in **Marriage Story**?,,ki7i33d,198fuun,1,2024-01-17 00:29:02,https://www.reddit.com/r/netflix/comments/198fuun/whats_that_new_netflix_program_that_starts_of/ki7i33d
Expats? The one with nicole kidman?,,kib6pm1,198fuun,1,2024-01-17 17:54:25,https://www.reddit.com/r/netflix/comments/198fuun/whats_that_new_netflix_program_that_starts_of/kib6pm1
**OP didn't answer you but you are correct. That's it!**,,kim30fy,kib6pm1,1,2024-01-19 17:13:07,https://www.reddit.com/r/netflix/comments/198fuun/whats_that_new_netflix_program_that_starts_of/kim30fy
"Like the title says, every single time, I stop a series and get back to it the next day, Netflix remembers the wrong location.  Each time, it's about 3/4 of a show too far in. I have to backtrack and figure out where I left of, every single time. And yes, I paused the show each time before I turned off the device running Netflix. I see this happening when using my PC and FireTV stick. What gives?

Are you seeing this bug too?","Every, single, time, Netflix remembers the wrong position, always too far ahead.",178youw,0,0,2023-10-16 06:28:19,https://www.reddit.com/r/netflix/comments/178youw/every_single_time_netflix_remembers_the_wrong/
It seems somebody bas your password and is just doing you dirty. If you examine yourself do you think there are people in your life who could do that to you?,,k52wrdd,178youw,3,2023-10-16 06:34:20,https://www.reddit.com/r/netflix/comments/178youw/every_single_time_netflix_remembers_the_wrong/k52wrdd
I have been experiencing this as well. I wonder what's happening.,,k53xecd,178youw,1,2023-10-16 13:49:27,https://www.reddit.com/r/netflix/comments/178youw/every_single_time_netflix_remembers_the_wrong/k53xecd
I'm having this problem with Disney +.,,k55ijis,178youw,1,2023-10-16 19:55:53,https://www.reddit.com/r/netflix/comments/178youw/every_single_time_netflix_remembers_the_wrong/k55ijis
I don't think so. They're all asleep.,,k52xnau,k52wrdd,1,2023-10-16 06:44:41,https://www.reddit.com/r/netflix/comments/178youw/every_single_time_netflix_remembers_the_wrong/k52xnau
I can’t remember it and im trying to watch it. Its been promoted on YouTube ads heavily but I haven’t seen it and forgot the name.  Please help its really bugging me that i can’t remember it was recently released too pretty sure it was a movie .,Whats that new Netflix program that starts of with” sometimes i dont want to wake up as someones (I think it was wife or mother) in the first few seconds of the trailer?,1956szi,0,0,2024-01-12 21:48:12,https://www.reddit.com/r/netflix/comments/1956szi/whats_that_new_netflix_program_that_starts_of/
"I’m hoping someone else has encountered this bug and figured it out already, but when I go to watch the English dubbings of foreign language movies, the dubs that say they’re in English often don’t actually play  English audio. Frustratingly enough, when I select ‘English dubbing with audio descriptions’ it *is* in English, but then I have to deal with the audio descriptions of everything on the screen. 

This most recently happened on the movie “Christmas as Usual”, but also happened several months ago on “Faraway”, which also never resolved for us.

Does anyone have any thoughts? We’re using Netflix on an AppleTV (model A1625), and are running tvOS 17.1",English dubbing is not actually playing English audio,18fktwn,0,0,2023-12-11 03:09:27,https://www.reddit.com/r/netflix/comments/18fktwn/english_dubbing_is_not_actually_playing_english/
"On Christmas As Usual, I just ended up playing the original audio and it turned out  to be in English, surprisingly. I never finished it, but I assume maybe there’s some parts in Norwegian that they just subtitle automatically. 

Also, the English dub is usually the second option to come up, if there is dubbing offered. If you start searching all those other options you’ll find yourself in the “audio descriptions” setting. I rarely go too deep into the “more options” section because of that. 

(And yes, I know the original language audio is always better but sometimes I am doing other things and need to be able to hear the dialogue, not just read subtitles. Depends on the day.)",,kcvftjv,18fktwn,1,2023-12-11 06:31:44,https://www.reddit.com/r/netflix/comments/18fktwn/english_dubbing_is_not_actually_playing_english/kcvftjv
"I did not know what to expect and figured it would be more background noise probably while I worked. 

I was pleasantly surprised though by it having more interesting parts than expected. Admittedly, I found Carols voice grating if she monologues too long, but still enjoyable. 

The ONE thing that bugged the ever living shit out of me, even though I know it’s not the main point, is how big a deal they made about money not meaning anything anymore. There are SO many holes and issues with this. Here are a few right off the top of my head:

The military: why the fuck do they still do their job and not just do nothing and/or everything they want the way literally everyone else presented does?

Basic societal functionality: How exactly do power, water, etc all stay on if no one works or has incentive to? On top of that, who is flying these planes to Tibet, Paris etc.? Who is doing baggage handling, servicing the planes, cleaning etc.? Who is transporting food cross country, tending the farms, hauling garbage, etc.? Is it just middle class and up that get to wallow in self pity and travel and do absolutely whatever they want? Is this a subtext about how the world will still stay awful and unfair, even with impending apocalypse? 

If they just made it an “in passing” aspect of the show I would leave it alone. But it’s SUCH a huge part that it was kind of annoying how unthought out it was.",Carol and the End of the World,18lvugh,0,98,2023-12-19 07:02:24,https://www.reddit.com/r/netflix/comments/18lvugh/carol_and_the_end_of_the_world/
"Only saw the first episode yet, but i gave that point a thought while watching. My take on it is that people volunteer to do so.. I guess if I had a post at the electric company in this situation- I’d feel mighty good about myself if I kept the power going for everyone. Same with pilots, firemen, soldiers, etc.
Not everyone’s sense of fullfilment derives from ‘seizing the day’.
I wonder if they’ll address that later in the season.",,ke0owto,18lvugh,20,2023-12-19 10:13:59,https://www.reddit.com/r/netflix/comments/18lvugh/carol_and_the_end_of_the_world/ke0owto
"Haha yes I thought the same while watching the show. You would think the world would be a much more dangerous and chaotic place if money didn’t matter anymore. But I guess maybe just like Carol wanted to keep her routine by working in an office, it might be comforting for others as well by still keeping their old jobs.",,ke44694,18lvugh,14,2023-12-20 00:33:16,https://www.reddit.com/r/netflix/comments/18lvugh/carol_and_the_end_of_the_world/ke44694
"I think they did this because they wanted to. Maybe they wanted to feel normal, were workaholics, were too afraid to pursue their dreams (“maybe the things they idealised wouldn’t be so great after all?”) or working was their dream, maybe they wanted the structure or help people, have an impact on their lives. 


This show made me wonder about what I would do if the world was about to end.. and in a way it will. I’m gonna die one day, like everyone else, the difference is that even without us life will still exist and new generations will continue our legacy. But back to the topic:


I’m currently unemployed, so I came to appreciate working. I miss being occupied, being productive, having a schedule. If the world was gonna end in a year from now I’d be working. Not necessarily in a traditional way, because I wouldn’t waste time I could spend with my animals. I could grow vegetables or something.",,ke1n4z6,18lvugh,12,2023-12-19 15:23:05,https://www.reddit.com/r/netflix/comments/18lvugh/carol_and_the_end_of_the_world/ke1n4z6
"They kinda get around it by saying that the military is taking care of basic societal needs, but I'm willing to suspend disbelief.

As an office drone, I actually find myself really identifying with her.

The voice actor was amazing in Baskets.",,ke2hkfq,18lvugh,9,2023-12-19 18:28:27,https://www.reddit.com/r/netflix/comments/18lvugh/carol_and_the_end_of_the_world/ke2hkfq
"I feel like it's pretty easy to explain away the military. Serving members are promised access to some sort of last ditch effort to survive the impact or escape the earth. I could see what fragments of the government exist lying in order to keep stuff from descending into anarchy.   
More likely though the government, public service jobs, grid infrastructure is all being handled by other ""Distractions"". Given the opportunity to do whatever they want, I feel a lot of people would want direction more than anything.   
A vast majority of the people in the show's world just want to keep doing the same thing out of comfort. I think it speaks to the power of the conditioning in the world we occupy. And we kinda get a glimpse of this with the Somalian Pirates, who keep pirating, despite there being nothing of value to steal.  
Why would they keep pirating? Just grab a ship and go wherever you want to go! But, they don't do that til they make a human connection. Because before that, pirating was all they knew. 

Or, I am overthinking everything. I've been thinking bout this show for like 2 days straight.",,ke9yp8z,18lvugh,9,2023-12-21 03:28:52,https://www.reddit.com/r/netflix/comments/18lvugh/carol_and_the_end_of_the_world/ke9yp8z
Isn't one of the main points of the show/the distraction to show that there are many people who would love to just work to forget the apocalypse?,,kei4ucf,18lvugh,7,2023-12-22 19:35:55,https://www.reddit.com/r/netflix/comments/18lvugh/carol_and_the_end_of_the_world/kei4ucf
